created_at,user_name,description,user_location,text,language,hashtags,media_url,place
2022-03-16 11:13:00+00:00,pah1974,"ship spotter.posting pics and video's of ships from felixstowe,great yarmouth and sometimes from the Thames.   Also big film fan and most sci-fi stuff.",,Dfds TULIPA SEAWAYS departing the Port of Felixstowe 15/3/22. https://t.co/O1LNgCEO1h,en,,['https://pbs.twimg.com/media/FN94ED5XsAo6hYU.jpg'],
2022-03-16 11:10:12+00:00,pah1974,"ship spotter.posting pics and video's of ships from felixstowe,great yarmouth and sometimes from the Thames.   Also big film fan and most sci-fi stuff.",,Ro-Ro ship ML FREYJA heading for the old navy yard berth at Harwich 15/3/22 https://t.co/2su926ataZ,en,,['https://pbs.twimg.com/media/FN93RW2WUAEfQLD.jpg'],
2022-03-16 11:07:34+00:00,pah1974,"ship spotter.posting pics and video's of ships from felixstowe,great yarmouth and sometimes from the Thames.   Also big film fan and most sci-fi stuff.",,Empty feeder containership A LA MARINE heading into the Port of Felixstowe 15/3/22 https://t.co/6S53UbAbdh,en,,['https://pbs.twimg.com/media/FN921a4WQAsHdSO.jpg'],
2022-03-16 11:06:01+00:00,pah1974,"ship spotter.posting pics and video's of ships from felixstowe,great yarmouth and sometimes from the Thames.   Also big film fan and most sci-fi stuff.",,MAERSK KLEVIN departing the Port of Felixstowe 15/3/22 https://t.co/aKFlHr1gqd,en,,['https://pbs.twimg.com/media/FN92blCXsAoe-zR.jpg'],
2022-03-10 19:06:17+00:00,pah1974,"ship spotter.posting pics and video's of ships from felixstowe,great yarmouth and sometimes from the Thames.   Also big film fan and most sci-fi stuff.",,Tug RT PETER between Gravesend and Tilbury 10/3/22. https://t.co/mQOWZUiA20,en,,['https://pbs.twimg.com/media/FNgq1iHXEAMqq6z.jpg'],
2022-03-10 19:04:18+00:00,pah1974,"ship spotter.posting pics and video's of ships from felixstowe,great yarmouth and sometimes from the Thames.   Also big film fan and most sci-fi stuff.",,Thames tug VB PANTHER between Gravesend and Tilbury 10/3/22. https://t.co/LZPl8AfhqX,en,,['https://pbs.twimg.com/media/FNgqSkfXMAcCU-5.jpg'],
2022-03-10 14:29:12+00:00,pah1974,"ship spotter.posting pics and video's of ships from felixstowe,great yarmouth and sometimes from the Thames.   Also big film fan and most sci-fi stuff.",,Virgin voyages VALIANT LADY making her maiden arrival at Tilbury 10/3/22. https://t.co/P7mijGVrm0,en,,['https://pbs.twimg.com/media/FNfrSR4UYAAt9bK.jpg'],
2022-03-04 14:28:08+00:00,pah1974,"ship spotter.posting pics and video's of ships from felixstowe,great yarmouth and sometimes from the Thames.   Also big film fan and most sci-fi stuff.",,Small tug/workboat ASSASSIN makes her way up the River Orwell to the port of ipswich 4/3/22. https://t.co/ReECG18S6r,en,,['https://pbs.twimg.com/media/FNAxx_AXoAMyNH2.jpg'],
2022-03-04 14:25:52+00:00,pah1974,"ship spotter.posting pics and video's of ships from felixstowe,great yarmouth and sometimes from the Thames.   Also big film fan and most sci-fi stuff.",,Dredger SAND FULMAR on approach to the port of ipswich 4/3/22. https://t.co/WwBgIXF2Hx,en,,['https://pbs.twimg.com/media/FNAwsF6XoAUKGnP.jpg'],
2022-02-28 17:00:41+00:00,pah1974,"ship spotter.posting pics and video's of ships from felixstowe,great yarmouth and sometimes from the Thames.   Also big film fan and most sci-fi stuff.",,Vehicles carrier RCC ANTWERP heading for Tilbury ro-ro 28/2/22. https://t.co/S6yKO8W4Sb,en,,['https://pbs.twimg.com/media/FMsuHvLX0AEiiFV.jpg'],
2022-02-28 16:33:27+00:00,pah1974,"ship spotter.posting pics and video's of ships from felixstowe,great yarmouth and sometimes from the Thames.   Also big film fan and most sci-fi stuff.",,Ro-Ro cargo ship VESPERTINE passing Tilbury inbound for purfleet 28/2/22. https://t.co/PBnABjvOXl,en,,['https://pbs.twimg.com/media/FMsoMKgXMAYgkG1.jpg'],
2022-02-28 16:27:30+00:00,pah1974,"ship spotter.posting pics and video's of ships from felixstowe,great yarmouth and sometimes from the Thames.   Also big film fan and most sci-fi stuff.",,General cargo ship KATE C passing Tilbury inbound to northfleet 28/2/22. https://t.co/iA02XDLfaj,en,,['https://pbs.twimg.com/media/FMsmpCXXIAEvLLR.jpg'],
2022-02-28 16:17:57+00:00,pah1974,"ship spotter.posting pics and video's of ships from felixstowe,great yarmouth and sometimes from the Thames.   Also big film fan and most sci-fi stuff.",,Superyacht LUSINE outbound from Tilbury dock heading for gibraltar 28/2/22 https://t.co/peCF5AeTFW,en,,['https://pbs.twimg.com/media/FMskOa8WYAUHZba.jpg'],
2021-12-24 16:41:53+00:00,pah1974,"ship spotter.posting pics and video's of ships from felixstowe,great yarmouth and sometimes from the Thames.   Also big film fan and most sci-fi stuff.",,EVER AIM departing the Port of Felixstowe after her maiden call 22/12/21. https://t.co/EnSRFLeM6T,en,,['https://pbs.twimg.com/media/FHYw-F1WYAIdgj_.jpg'],
2021-12-24 14:04:14+00:00,pah1974,"ship spotter.posting pics and video's of ships from felixstowe,great yarmouth and sometimes from the Thames.   Also big film fan and most sci-fi stuff.",,MSC ISTANBUL at berth9 with EVER AIM on her maiden visit about to leave berth8 at the Port of Felixstowe 22/12/21. https://t.co/Uwvz6WgPQr,en,,['https://pbs.twimg.com/media/FHYMQtSXwAA_R5z.jpg'],
2021-12-22 18:51:52+00:00,pah1974,"ship spotter.posting pics and video's of ships from felixstowe,great yarmouth and sometimes from the Thames.   Also big film fan and most sci-fi stuff.",,Survey/research vessel PATRIOT passing Felixstowe 22/12/21 https://t.co/oHjyO071th,en,,['https://pbs.twimg.com/media/FHO7jv4XIBYuLDz.jpg'],
2021-12-15 15:38:37+00:00,pah1974,"ship spotter.posting pics and video's of ships from felixstowe,great yarmouth and sometimes from the Thames.   Also big film fan and most sci-fi stuff.",,Offshore construction jack-up WIND SERVER passing Felixstowe inbound for the Port of Harwich 15/12/21. https://t.co/r4sjeCwPF5,en,,['https://pbs.twimg.com/media/FGqL-x7XwAIkEgi.jpg'],
2021-11-09 16:48:25+00:00,pah1974,"ship spotter.posting pics and video's of ships from felixstowe,great yarmouth and sometimes from the Thames.   Also big film fan and most sci-fi stuff.",,MCS ANNEKE passing Felixstowe inbound to Harwich 6/11/21 https://t.co/LLPbi4ZXjk,en,,['https://pbs.twimg.com/media/FDxC7tUXsB4HCXA.jpg'],
2021-11-07 11:34:41+00:00,pah1974,"ship spotter.posting pics and video's of ships from felixstowe,great yarmouth and sometimes from the Thames.   Also big film fan and most sci-fi stuff.",,25year old MAERSK KLEVEN on approach to the Port of Felixstowe 6/11/21. https://t.co/MiZ4cEssH1,en,,['https://pbs.twimg.com/media/FDln-7hWQAEBsW0.jpg'],
2021-11-06 14:14:37+00:00,pah1974,"ship spotter.posting pics and video's of ships from felixstowe,great yarmouth and sometimes from the Thames.   Also big film fan and most sci-fi stuff.",,Tanker ESKE passing Felixstowe outbound from Harwich 6/11/21. https://t.co/gRw7QDFkHB,en,,['https://pbs.twimg.com/media/FDhC_0IWQAYKzKQ.jpg'],
2021-11-06 14:12:02+00:00,pah1974,"ship spotter.posting pics and video's of ships from felixstowe,great yarmouth and sometimes from the Thames.   Also big film fan and most sci-fi stuff.",,EVER GENTLE arriving at the Port of Felixstowe 6/11/21. https://t.co/OpQ7QJIkba,en,,['https://pbs.twimg.com/media/FDhCY99WUAM9G_C.jpg'],
2021-11-06 14:10:26+00:00,pah1974,"ship spotter.posting pics and video's of ships from felixstowe,great yarmouth and sometimes from the Thames.   Also big film fan and most sci-fi stuff.",,Diving support vessel HBC ACHEIVER inbound for Harwich 6/11/21. https://t.co/rHUUq9Zuok,en,,['https://pbs.twimg.com/media/FDhCBb9XMAQ9qop.jpg'],
2021-11-06 14:08:40+00:00,pah1974,"ship spotter.posting pics and video's of ships from felixstowe,great yarmouth and sometimes from the Thames.   Also big film fan and most sci-fi stuff.",,Ultra large OOCL INDONESIA departing berth9 at the port of Felixstowe 6/11/21. https://t.co/BRBAfrRdy0,en,,['https://pbs.twimg.com/media/FDhBacZX0AYOEoQ.jpg'],
2021-10-19 13:55:02+00:00,pah1974,"ship spotter.posting pics and video's of ships from felixstowe,great yarmouth and sometimes from the Thames.   Also big film fan and most sci-fi stuff.",,Bulk carrier PETREL S sailing up the river orwell for the port of ipswich 19/10/21. https://t.co/kZmGqs8CZT,en,,['https://pbs.twimg.com/media/FCERygoWUAgaDKS.jpg'],
2021-10-17 19:50:25+00:00,pah1974,"ship spotter.posting pics and video's of ships from felixstowe,great yarmouth and sometimes from the Thames.   Also big film fan and most sci-fi stuff.",,RMS BAERL passing Felixstowe inbound for the port of Ipswich 16/10/21 https://t.co/4laK1GfUiN,en,,['https://pbs.twimg.com/media/FB7P7BdXEAEMzHI.jpg'],
2021-10-16 14:20:27+00:00,pah1974,"ship spotter.posting pics and video's of ships from felixstowe,great yarmouth and sometimes from the Thames.   Also big film fan and most sci-fi stuff.",,GSL KALLIOPI passing dredger sospan-dau on approach to the beach end turn and into the Port of Felixstowe 16/10/21. https://t.co/3U43pQ741R,en,,['https://pbs.twimg.com/media/FB06bBFXsAY9XoF.jpg'],
2021-10-16 14:16:29+00:00,pah1974,"ship spotter.posting pics and video's of ships from felixstowe,great yarmouth and sometimes from the Thames.   Also big film fan and most sci-fi stuff.",,VOLGA MAERSK departing the Port of Felixstowe this morning. https://t.co/Ltg9tUNuSV,en,,['https://pbs.twimg.com/media/FB05_uRXEAcXK0g.jpg'],
2021-10-16 14:14:15+00:00,pah1974,"ship spotter.posting pics and video's of ships from felixstowe,great yarmouth and sometimes from the Thames.   Also big film fan and most sci-fi stuff.",,THV PATRICIA outbound from Harwich this morning. https://t.co/lLHxxEluG0,en,,['https://pbs.twimg.com/media/FB05ndCXMAEIHfk.jpg'],
2021-10-16 14:12:34+00:00,pah1974,"ship spotter.posting pics and video's of ships from felixstowe,great yarmouth and sometimes from the Thames.   Also big film fan and most sci-fi stuff.",,Ultra large EVER GENIUS about to depart berth9 at the Port of Felixstowe this morning. https://t.co/FQhUI9UlJ2,en,,['https://pbs.twimg.com/media/FB04_p2XEAczV1a.jpg'],
2021-10-01 18:10:39+00:00,pah1974,"ship spotter.posting pics and video's of ships from felixstowe,great yarmouth and sometimes from the Thames.   Also big film fan and most sci-fi stuff.",,RT @BBCLookEast: Stewart White says farewell on BBC Look East after 37 years. https://t.co/MvfGp5BHui,en,,['https://pbs.twimg.com/amplify_video_thumb/1443653090457100291/img/skMqYvKA71jEWpUa.jpg'],
2021-09-15 16:31:09+00:00,pah1974,"ship spotter.posting pics and video's of ships from felixstowe,great yarmouth and sometimes from the Thames.   Also big film fan and most sci-fi stuff.",,EVER ACE - World's biggest containership departing the port of felixstowe this afternoon. https://t.co/v9OMIz8LJN,en,,['https://pbs.twimg.com/media/E_VvfRwXIAAxCr6.jpg'],
2021-09-07 17:14:35+00:00,pah1974,"ship spotter.posting pics and video's of ships from felixstowe,great yarmouth and sometimes from the Thames.   Also big film fan and most sci-fi stuff.",,MANISA STAR sailing up the River Orwell for the port of ipswich this afternoon. https://t.co/1JMQafcTtN,en,,['https://pbs.twimg.com/media/E-sss1UXMAQb45Q.jpg'],
2021-09-02 16:47:06+00:00,pah1974,"ship spotter.posting pics and video's of ships from felixstowe,great yarmouth and sometimes from the Thames.   Also big film fan and most sci-fi stuff.",,ONE MANHATTEN passing Canvey island inbound to London Gateway 2/9/21 https://t.co/FsQetApoWv,en,,['https://pbs.twimg.com/media/E-S2RZXXMAchQ8N.jpg'],
2021-08-30 13:40:46+00:00,pah1974,"ship spotter.posting pics and video's of ships from felixstowe,great yarmouth and sometimes from the Thames.   Also big film fan and most sci-fi stuff.",,Thames sailing barge VICTOR passing under the orwell bridge 28/8/21. https://t.co/frhodicM9W,en,,['https://pbs.twimg.com/media/E-CvFCtXEAYKv0B.jpg'],
2021-08-30 11:18:36+00:00,pah1974,"ship spotter.posting pics and video's of ships from felixstowe,great yarmouth and sometimes from the Thames.   Also big film fan and most sci-fi stuff.",,Tug GRAY SALVOR departing ipswich to meet incoming ship fagelgracht 28/8/21. https://t.co/ahj8D7MqfK,en,,['https://pbs.twimg.com/media/E-COWhLWEAMNS_Q.jpg'],
2021-08-10 12:03:45+00:00,pah1974,"ship spotter.posting pics and video's of ships from felixstowe,great yarmouth and sometimes from the Thames.   Also big film fan and most sci-fi stuff.",,ORWELL LADY about to pass under the orwell bridge inbound to ipswich 6/8/21. https://t.co/x695qXMY53,en,,['https://pbs.twimg.com/media/E8bZFefWQCgZVCX.jpg'],
2021-08-10 12:01:44+00:00,pah1974,"ship spotter.posting pics and video's of ships from felixstowe,great yarmouth and sometimes from the Thames.   Also big film fan and most sci-fi stuff.",,CWIND CHALLENGER outbound from fox's marina ipswich and heading for Brightlingsea 6/8/21. https://t.co/Hq17bIj0hI,en,,['https://pbs.twimg.com/media/E8bYcMiXEAEBwSy.jpg'],
2021-08-06 12:48:06+00:00,pah1974,"ship spotter.posting pics and video's of ships from felixstowe,great yarmouth and sometimes from the Thames.   Also big film fan and most sci-fi stuff.",,General cargo ship WILSON LIMERICK inbound to the Port of ipswich 6/8/21. https://t.co/DIDeYbSo0c,en,,['https://pbs.twimg.com/media/E8G8zvpXEAUoCGC.jpg'],
2021-08-06 12:17:03+00:00,pah1974,"ship spotter.posting pics and video's of ships from felixstowe,great yarmouth and sometimes from the Thames.   Also big film fan and most sci-fi stuff.",,Passenger ship ISLAND SKY sailing up the River Orwell for the port of ipswich 6/8/21. https://t.co/QK5KKPYlRL,en,,['https://pbs.twimg.com/media/E8G1yYeWYAA7Pim.jpg'],
2021-08-04 09:08:02+00:00,pah1974,"ship spotter.posting pics and video's of ships from felixstowe,great yarmouth and sometimes from the Thames.   Also big film fan and most sci-fi stuff.",,GOLDEN HORIZON passing felixstowe around 7am this morning inbound to Harwich. https://t.co/4Y9Ifvud60,en,,['https://pbs.twimg.com/media/E773UUpWQAAesOX.jpg'],
2021-08-03 15:41:14+00:00,pah1974,"ship spotter.posting pics and video's of ships from felixstowe,great yarmouth and sometimes from the Thames.   Also big film fan and most sci-fi stuff.",,Suez canal blocker EVER GIVEN arriving at the port of felixstowe 3/7/21. https://t.co/ZAOktBTANR,en,,['https://pbs.twimg.com/media/E74HuW1XEAIk3cw.jpg'],
2021-07-31 09:44:58+00:00,pah1974,"ship spotter.posting pics and video's of ships from felixstowe,great yarmouth and sometimes from the Thames.   Also big film fan and most sci-fi stuff.",,"Harwich Lifeboat 17-03 ""Albert Brown"" passing felixstowe heading back to Harwich 28/7/21. https://t.co/Qo5LidF3rn",en,,['https://pbs.twimg.com/media/E7nZMi1WUAgxARr.jpg'],
2021-07-29 06:54:10+00:00,pah1974,"ship spotter.posting pics and video's of ships from felixstowe,great yarmouth and sometimes from the Thames.   Also big film fan and most sci-fi stuff.",,GSL NINGBO departing the port of felixstowe 28/7/21. https://t.co/Xy0O8YUb2l,en,,['https://pbs.twimg.com/media/E7cfG8OX0AMyg5a.jpg'],
2021-07-20 12:37:25+00:00,pah1974,"ship spotter.posting pics and video's of ships from felixstowe,great yarmouth and sometimes from the Thames.   Also big film fan and most sci-fi stuff.",,New polar research ship SIR DAVID ATTENBOROUGH passing felixstowe inbound for Harwich 20/7/21. https://t.co/y6l059heSr,en,,['https://pbs.twimg.com/media/E6vXbjnWQBEBibe.jpg'],
2021-07-16 16:47:45+00:00,pah1974,"ship spotter.posting pics and video's of ships from felixstowe,great yarmouth and sometimes from the Thames.   Also big film fan and most sci-fi stuff.",,X-bow offshore supply ship VOS PACE arriving at Great Yarmouth 16/7/21 https://t.co/WoQ64He5cS,en,,['https://pbs.twimg.com/media/E6bqVqxWEAUq_Hi.jpg'],
2021-07-16 16:45:21+00:00,pah1974,"ship spotter.posting pics and video's of ships from felixstowe,great yarmouth and sometimes from the Thames.   Also big film fan and most sci-fi stuff.",,Cable layer WIND OF PRIDE inbound to Great Yarmouth's outer harbour 16/7/21. https://t.co/2G7Msrx4cI,en,,['https://pbs.twimg.com/media/E6bpuuLWUAUqsZX.jpg'],
2021-07-16 16:43:18+00:00,pah1974,"ship spotter.posting pics and video's of ships from felixstowe,great yarmouth and sometimes from the Thames.   Also big film fan and most sci-fi stuff.",,Offshore supply vessel VOS PRELUDE arriving at Great Yarmouth 16/7/21. https://t.co/cmATyNiJSK,en,,['https://pbs.twimg.com/media/E6bpXrXXEAI1YxV.jpg'],
2021-07-14 16:55:53+00:00,pah1974,"ship spotter.posting pics and video's of ships from felixstowe,great yarmouth and sometimes from the Thames.   Also big film fan and most sci-fi stuff.",,AMBERLAND also inbound for the port of ipswich 14/7/21. https://t.co/dYXXpzmop5,en,,['https://pbs.twimg.com/media/E6RZDlpXsAgVBhl.jpg'],
2021-07-14 16:54:17+00:00,pah1974,"ship spotter.posting pics and video's of ships from felixstowe,great yarmouth and sometimes from the Thames.   Also big film fan and most sci-fi stuff.",,AASTIND heading up the River Orwell for the port of ipswich 14/7/21. https://t.co/wIHU5DSsvo,en,,['https://pbs.twimg.com/media/E6RYqplX0AED3M1.jpg'],
2021-07-08 17:11:15+00:00,pah1974,"ship spotter.posting pics and video's of ships from felixstowe,great yarmouth and sometimes from the Thames.   Also big film fan and most sci-fi stuff.",,A rusty cosco in the old grey colour.COSCO GLORY departing berth9 at the port of felixstowe 8/7/21. https://t.co/uE6Wgy4tv2,en,,['https://pbs.twimg.com/media/E5yiimdXMAAVQf0.jpg'],
2021-06-12 16:04:06+00:00,pah1974,"ship spotter.posting pics and video's of ships from felixstowe,great yarmouth and sometimes from the Thames.   Also big film fan and most sci-fi stuff.",,Oil/chemical tanker SCANDIC inbound passing tilbury fort 11/6/21. https://t.co/8Y9rOHTUYt,en,,['https://pbs.twimg.com/media/E3saSTAWEAMwaFf.jpg'],
2021-06-12 15:59:29+00:00,pah1974,"ship spotter.posting pics and video's of ships from felixstowe,great yarmouth and sometimes from the Thames.   Also big film fan and most sci-fi stuff.",,ARKLOW CADET outbound from tilbury docks 11/6/21. https://t.co/xQHWUb3SQM,en,,['https://pbs.twimg.com/media/E3sZSCgXIAgDYQY.jpg'],
2021-06-12 15:57:16+00:00,pah1974,"ship spotter.posting pics and video's of ships from felixstowe,great yarmouth and sometimes from the Thames.   Also big film fan and most sci-fi stuff.",,SPIRIT OF DISCOVERY returning to Tilbury after her first over night sea trials 11/6/21. https://t.co/XGegWec5kA,en,,['https://pbs.twimg.com/media/E3sYnnRWEAMDkaQ.jpg'],
2021-06-12 15:54:11+00:00,pah1974,"ship spotter.posting pics and video's of ships from felixstowe,great yarmouth and sometimes from the Thames.   Also big film fan and most sci-fi stuff.",,Tug VB PANTHER passing tilbury fort heading out to meet incoming Spirit of discovery 11/6/21. https://t.co/UyAeqCO5M0,en,,['https://pbs.twimg.com/media/E3sX4ycWQAIW__O.jpg'],
2021-06-12 15:51:19+00:00,pah1974,"ship spotter.posting pics and video's of ships from felixstowe,great yarmouth and sometimes from the Thames.   Also big film fan and most sci-fi stuff.",,Italian ro-ro cargo ship ALF POLLAK passing tilbury fort inbound to purfleet 11/6/21. https://t.co/qKZwLafYeM,en,,['https://pbs.twimg.com/media/E3sXOaJXIAQRmgd.jpg'],
2021-05-29 08:36:09+00:00,pah1974,"ship spotter.posting pics and video's of ships from felixstowe,great yarmouth and sometimes from the Thames.   Also big film fan and most sci-fi stuff.",,General cargo ship FRI KVAM passing felixstowe inbound for ipswich 28/5/21. https://t.co/5nP4WINOga,en,,['https://pbs.twimg.com/media/E2itjGjWYAEXrMM.jpg'],
2021-05-29 08:34:39+00:00,pah1974,"ship spotter.posting pics and video's of ships from felixstowe,great yarmouth and sometimes from the Thames.   Also big film fan and most sci-fi stuff.",,General cargo ship AASTUN passing felixstowe inbound for ipswich 28/5/21. https://t.co/hclsSjVItM,en,,['https://pbs.twimg.com/media/E2itL3uXwAIsnRl.jpg'],
2021-05-29 08:27:12+00:00,pah1974,"ship spotter.posting pics and video's of ships from felixstowe,great yarmouth and sometimes from the Thames.   Also big film fan and most sci-fi stuff.",,Freshly painted EMMA MAERSK departing berth9 at the port of felixstowe 28/5/21. https://t.co/UebrK88TCS,en,,['https://pbs.twimg.com/media/E2iraS3WEAEUlli.jpg'],
2021-05-29 08:24:46+00:00,pah1974,"ship spotter.posting pics and video's of ships from felixstowe,great yarmouth and sometimes from the Thames.   Also big film fan and most sci-fi stuff.",,Tug DUKE OF NORMANDY working at the port of felixstowe 28/5/21 https://t.co/sQpybHFTVx,en,,['https://pbs.twimg.com/media/E2iq5_LXwAERAXe.jpg'],
2021-05-23 17:10:23+00:00,pah1974,"ship spotter.posting pics and video's of ships from felixstowe,great yarmouth and sometimes from the Thames.   Also big film fan and most sci-fi stuff.",,Border Force vessel SEARCHER passing felixstowe outbound from ipswich at around 8:45am 23/5/21. https://t.co/1MnvAa1nR6,en,,['https://pbs.twimg.com/media/E2FpbutX0AgsRZ1.jpg'],
2021-05-23 11:16:02+00:00,pah1974,"ship spotter.posting pics and video's of ships from felixstowe,great yarmouth and sometimes from the Thames.   Also big film fan and most sci-fi stuff.",,Tug TRITON arriving at the port of felixstowe from the Thames 23/5/21. https://t.co/vXHDP8yNGW,en,,['https://pbs.twimg.com/media/E2EYgEvWYAEcxlA.jpg'],
2021-05-15 14:30:44+00:00,pah1974,"ship spotter.posting pics and video's of ships from felixstowe,great yarmouth and sometimes from the Thames.   Also big film fan and most sci-fi stuff.",,58m length RIVER TRADER on a rare visit up the river orwell for the port of ipswich 15/5/21. https://t.co/5QkC0yjzTe,en,,['https://pbs.twimg.com/media/E1b4SnbWUAct_fJ.jpg'],
2021-05-07 11:22:24+00:00,pah1974,"ship spotter.posting pics and video's of ships from felixstowe,great yarmouth and sometimes from the Thames.   Also big film fan and most sci-fi stuff.",,VUOKSI MAERSK arriving at the port of felixstowe 5/5/21. https://t.co/UVHH81Vb6y,fi,,['https://pbs.twimg.com/media/E0yApd1X0AE_NAU.jpg'],
2021-05-07 11:20:51+00:00,pah1974,"ship spotter.posting pics and video's of ships from felixstowe,great yarmouth and sometimes from the Thames.   Also big film fan and most sci-fi stuff.",,WYBELSUM on approach to the port of felixstowe 5/5/21. https://t.co/oAe32U9NED,en,,['https://pbs.twimg.com/media/E0yAPfEXsAcbkwV.jpg'],
2021-05-07 11:19:07+00:00,pah1974,"ship spotter.posting pics and video's of ships from felixstowe,great yarmouth and sometimes from the Thames.   Also big film fan and most sci-fi stuff.",,MOSCOW MAERSK arriving at the port of felixstowe 5/5/21. https://t.co/QHui6QCydb,en,,['https://pbs.twimg.com/media/E0x_8GaXEAUO0fv.jpg'],
2021-05-07 11:16:54+00:00,pah1974,"ship spotter.posting pics and video's of ships from felixstowe,great yarmouth and sometimes from the Thames.   Also big film fan and most sci-fi stuff.",,SVITZER INTREPID back at the port of felixstowe while svitzer shotley is away in dry dock 5/5/21. https://t.co/s9Q4OMm4EO,en,,['https://pbs.twimg.com/media/E0x_MjtWYAEXmR-.jpg'],
2021-05-01 14:54:14+00:00,pah1974,"ship spotter.posting pics and video's of ships from felixstowe,great yarmouth and sometimes from the Thames.   Also big film fan and most sci-fi stuff.",,GLOMAR WAVE at Great Yarmouth 29/4/21. https://t.co/047AO5MEJN,en,,['https://pbs.twimg.com/media/E0T3plzWQAAOasu.jpg'],
2021-05-01 14:51:47+00:00,pah1974,"ship spotter.posting pics and video's of ships from felixstowe,great yarmouth and sometimes from the Thames.   Also big film fan and most sci-fi stuff.",,Platform support ship IEVOLI IVORY berthed at Great Yarmouth 29/4/21. https://t.co/fua6rysjkR,en,,['https://pbs.twimg.com/media/E0T23w1WEAUErrp.jpg'],
2021-04-29 15:08:35+00:00,pah1974,"ship spotter.posting pics and video's of ships from felixstowe,great yarmouth and sometimes from the Thames.   Also big film fan and most sci-fi stuff.",,Tanker SARNIA CHERIE backing down the river yare and departing Great Yarmouth 29/4/21. https://t.co/0eQikipEhH,en,,['https://pbs.twimg.com/media/E0JnmHOXMAUT_ld.jpg'],
2021-04-29 15:06:29+00:00,pah1974,"ship spotter.posting pics and video's of ships from felixstowe,great yarmouth and sometimes from the Thames.   Also big film fan and most sci-fi stuff.",,MAERSK HANDLER departing Great Yarmouth after a 3hr visit 29/4/21. https://t.co/IWa6Y8P5is,en,,['https://pbs.twimg.com/media/E0JnIHvXIAIlYqE.jpg'],
2021-04-29 15:03:26+00:00,pah1974,"ship spotter.posting pics and video's of ships from felixstowe,great yarmouth and sometimes from the Thames.   Also big film fan and most sci-fi stuff.",,Anchor handling vessel MAERSK HANDLER arriving at Great Yarmouth 29/4/21. https://t.co/qA1yFo6fF6,en,,['https://pbs.twimg.com/media/E0JmMJ9X0AI8Zfx.jpg'],
2021-04-24 14:17:18+00:00,pah1974,"ship spotter.posting pics and video's of ships from felixstowe,great yarmouth and sometimes from the Thames.   Also big film fan and most sci-fi stuff.",,Fishing boat KITTIWAKE RX439 passing felixstowe 22/4/21. https://t.co/uESfMRlpY7,en,,['https://pbs.twimg.com/media/Ezvr51GXEAMubEw.jpg'],
2021-04-24 14:14:21+00:00,pah1974,"ship spotter.posting pics and video's of ships from felixstowe,great yarmouth and sometimes from the Thames.   Also big film fan and most sci-fi stuff.",,Feeder containership PANTONIO departing the port of felixstowe 22/4/21. https://t.co/vHBqEfP2mu,en,,['https://pbs.twimg.com/media/EzvrWTAX0Ac8u8x.jpg'],
2021-04-24 14:12:02+00:00,pah1974,"ship spotter.posting pics and video's of ships from felixstowe,great yarmouth and sometimes from the Thames.   Also big film fan and most sci-fi stuff.",,Tanker SPECIALITY passing Felixstowe outbound from Harwich 22/4/21. https://t.co/eQ3gYM2w8O,en,,['https://pbs.twimg.com/media/EzvqxoIXsAAiQqI.jpg'],
2021-04-24 14:09:42+00:00,pah1974,"ship spotter.posting pics and video's of ships from felixstowe,great yarmouth and sometimes from the Thames.   Also big film fan and most sci-fi stuff.",,MSC SHRISTI on approach to the port of felixstowe 22/4/21. https://t.co/EufI4RHzht,en,,['https://pbs.twimg.com/media/EzvqSI3XoAA4ibI.jpg'],
2021-04-24 14:07:53+00:00,pah1974,"ship spotter.posting pics and video's of ships from felixstowe,great yarmouth and sometimes from the Thames.   Also big film fan and most sci-fi stuff.",,OOCL HONG KONG arriving at the port of felixstowe 22/4/21. https://t.co/H6kiC9T1Yt,en,,['https://pbs.twimg.com/media/Ezvp44ZXMAAl9E2.jpg'],
2021-04-10 17:04:52+00:00,pah1974,"ship spotter.posting pics and video's of ships from felixstowe,great yarmouth and sometimes from the Thames.   Also big film fan and most sci-fi stuff.",,VILNIA MAERSK arriving at the port of felixstowe 9/4/21. https://t.co/kgENR6sERM,en,,['https://pbs.twimg.com/media/EyoMHFCW8AIPLWR.jpg'],
2021-04-10 17:03:14+00:00,pah1974,"ship spotter.posting pics and video's of ships from felixstowe,great yarmouth and sometimes from the Thames.   Also big film fan and most sci-fi stuff.",,399m length MANILA MAERSK departing the port of felixstowe 9/4/21. https://t.co/N5ERKDijfW,en,,['https://pbs.twimg.com/media/EyoL00MWYAIkf_h.jpg'],
2021-04-10 16:55:12+00:00,pah1974,"ship spotter.posting pics and video's of ships from felixstowe,great yarmouth and sometimes from the Thames.   Also big film fan and most sci-fi stuff.",,BELLALAND passing felixstowe heading for ipswich 9/4/21. https://t.co/bmB6hoLa48,en,,['https://pbs.twimg.com/media/EyoJ5jkW8AIwdUb.jpg'],
2021-04-10 16:53:31+00:00,pah1974,"ship spotter.posting pics and video's of ships from felixstowe,great yarmouth and sometimes from the Thames.   Also big film fan and most sci-fi stuff.",,FRI LANGESUND passing felixstowe outbound from ipswich 9/4/21. https://t.co/Dc4fMC5U7t,en,,['https://pbs.twimg.com/media/EyoJb2yWUAkCdjF.jpg'],
2021-04-10 16:13:20+00:00,pah1974,"ship spotter.posting pics and video's of ships from felixstowe,great yarmouth and sometimes from the Thames.   Also big film fan and most sci-fi stuff.",,Tug GPS AVENGER departing the port of felixstowe 9/4/21. https://t.co/e1Mq39dI9Z,en,,['https://pbs.twimg.com/media/EyoARTZXAAMMjg_.jpg'],
2021-03-31 12:27:32+00:00,pah1974,"ship spotter.posting pics and video's of ships from felixstowe,great yarmouth and sometimes from the Thames.   Also big film fan and most sci-fi stuff.",,400m EVER GLORY departing the port of felixstowe 30/3/21. https://t.co/Gt3ZHnfRuc,en,,['https://pbs.twimg.com/media/ExzsryBWQAAMdoB.jpg'],
2021-03-31 12:25:44+00:00,pah1974,"ship spotter.posting pics and video's of ships from felixstowe,great yarmouth and sometimes from the Thames.   Also big film fan and most sci-fi stuff.",,MSC KATIE outbound from the port of felixstowe 30/3/21. https://t.co/2eOa03Zt7j,en,,['https://pbs.twimg.com/media/ExzsVaJXAAAE7wj.jpg'],
2021-03-31 12:22:07+00:00,pah1974,"ship spotter.posting pics and video's of ships from felixstowe,great yarmouth and sometimes from the Thames.   Also big film fan and most sci-fi stuff.",,EVELYN MAERSK departing the port of felixstowe 30/3/21. https://t.co/tZX45roS2G,en,,['https://pbs.twimg.com/media/Exzrg9ZWUAA5IRr.jpg'],
2021-03-31 08:11:31+00:00,pah1974,"ship spotter.posting pics and video's of ships from felixstowe,great yarmouth and sometimes from the Thames.   Also big film fan and most sci-fi stuff.",,Dredger CHARLEMAGNE passing felixstowe outbound from ipswich 30/3/21 https://t.co/Usj1ED5L1S,en,,['https://pbs.twimg.com/media/ExyyDuxUcAoTjGe.jpg'],
2021-02-07 10:33:24+00:00,pah1974,"ship spotter.posting pics and video's of ships from felixstowe,great yarmouth and sometimes from the Thames.   Also big film fan and most sci-fi stuff.",,The snow has returned to Suffolk. https://t.co/zwKcYrFKcf,en,,['https://pbs.twimg.com/media/EtnfDl-XEAQJJv5.jpg'],
2021-01-16 10:27:22+00:00,pah1974,"ship spotter.posting pics and video's of ships from felixstowe,great yarmouth and sometimes from the Thames.   Also big film fan and most sci-fi stuff.",,Snow in suffolk https://t.co/riDFE34wOP,en,,['https://pbs.twimg.com/media/Er2LpTSXYAAvhW3.jpg'],
2021-01-14 21:23:15+00:00,pah1974,"ship spotter.posting pics and video's of ships from felixstowe,great yarmouth and sometimes from the Thames.   Also big film fan and most sci-fi stuff.",,RT @P_Andy_Lucas: Halifax today https://t.co/4rRtGhnDJC,en,,['https://pbs.twimg.com/ext_tw_video_thumb/1349688859693559808/pu/img/8cbALIA4JIttqJi5.jpg'],
2020-12-19 16:50:38+00:00,pah1974,"ship spotter.posting pics and video's of ships from felixstowe,great yarmouth and sometimes from the Thames.   Also big film fan and most sci-fi stuff.",,Bulk carrier LILA departing the port of ipswich this afternoon with tugs gray test and svitzer sky from felixstowe. https://t.co/b1giaWB8VJ,en,,['https://pbs.twimg.com/media/EpnWflZXMAIxTKj.jpg'],
2020-12-16 16:02:59+00:00,pah1974,"ship spotter.posting pics and video's of ships from felixstowe,great yarmouth and sometimes from the Thames.   Also big film fan and most sci-fi stuff.",,THV PATRICIA outbound from Harwich 15/12/20. https://t.co/Gkx9VGCmcN,nl,,['https://pbs.twimg.com/media/EpXvD8jW8AIj1O7.jpg'],
2020-12-15 16:15:02+00:00,pah1974,"ship spotter.posting pics and video's of ships from felixstowe,great yarmouth and sometimes from the Thames.   Also big film fan and most sci-fi stuff.",,Ultra large MSC ISABELLA departing the port of felixstowe 15/12/20. https://t.co/XCsyg9CySR,en,,['https://pbs.twimg.com/media/EpSoQ1HXIAUDEux.jpg'],
2020-12-04 11:09:07+00:00,pah1974,"ship spotter.posting pics and video's of ships from felixstowe,great yarmouth and sometimes from the Thames.   Also big film fan and most sci-fi stuff.",,RT EVOLUTION heading back to Tilbury landing stage 1/12/20. https://t.co/LkLif0hF30,en,,['https://pbs.twimg.com/media/EoY4o1WW8AEXG7i.jpg'],
2020-12-04 11:06:31+00:00,pah1974,"ship spotter.posting pics and video's of ships from felixstowe,great yarmouth and sometimes from the Thames.   Also big film fan and most sci-fi stuff.",,SVITZER ADIRA passing gravesend inbound for Northfleet  1/12/20 https://t.co/9yKevSdbNa,en,,['https://pbs.twimg.com/media/EoY3_3wWEAM_AnR.jpg'],
2020-12-02 09:45:11+00:00,pah1974,"ship spotter.posting pics and video's of ships from felixstowe,great yarmouth and sometimes from the Thames.   Also big film fan and most sci-fi stuff.",,Dredger DC VLAANDEREN 3000 inbound on the thames passing gravesend 1/12/20. https://t.co/UBDxHjPEca,en,,['https://pbs.twimg.com/media/EoOSQgYXUAALy1e.jpg'],
2020-12-02 09:42:25+00:00,pah1974,"ship spotter.posting pics and video's of ships from felixstowe,great yarmouth and sometimes from the Thames.   Also big film fan and most sci-fi stuff.",,Ro-Ro cargo ship CELESTINE outbound on the thames passing gravesend 1/12/20. https://t.co/XkGFykGWg3,en,,['https://pbs.twimg.com/media/EoORq89XUAU16Fz.jpg'],
2020-12-02 09:40:23+00:00,pah1974,"ship spotter.posting pics and video's of ships from felixstowe,great yarmouth and sometimes from the Thames.   Also big film fan and most sci-fi stuff.",,LNG tanker RAMANDA inbound on the thames passing gravesend 1/12/20. https://t.co/mklZg4qJgf,en,,['https://pbs.twimg.com/media/EoORJWgXMAEEN-9.jpg'],
2020-11-26 17:01:48+00:00,pah1974,"ship spotter.posting pics and video's of ships from felixstowe,great yarmouth and sometimes from the Thames.   Also big film fan and most sci-fi stuff.",,Coaster WILSON DIEPPE departing the port of ipswich this afternoon. https://t.co/Jgzxf7dlJM,en,,['https://pbs.twimg.com/media/Enw8vYpW4AA7iwU.jpg'],
2020-11-26 17:00:08+00:00,pah1974,"ship spotter.posting pics and video's of ships from felixstowe,great yarmouth and sometimes from the Thames.   Also big film fan and most sci-fi stuff.",,Bulk carrier ADAPEARL heading up the river orwell for ipswich this afternoon. https://t.co/e2wglbUXrl,en,,['https://pbs.twimg.com/media/Enw8T2LXUAEZhZv.jpg'],
2020-10-06 15:50:18+00:00,pah1974,"ship spotter.posting pics and video's of ships from felixstowe,great yarmouth and sometimes from the Thames.   Also big film fan and most sci-fi stuff.",,Dutch tug MARS working at the port of felixstowe while svitzer deben is in dry dock 6/10/20. https://t.co/si0ml3Vru0,en,,['https://pbs.twimg.com/media/EjqC1hoXcAAFB1C.jpg'],
2020-09-23 11:51:18+00:00,pah1974,"ship spotter.posting pics and video's of ships from felixstowe,great yarmouth and sometimes from the Thames.   Also big film fan and most sci-fi stuff.",,RMS RATINGEN passing through Harwich Harbour heading for the port of ipswich 20/9/20. https://t.co/AkYN5vOcWZ,en,,['https://pbs.twimg.com/media/EimP7wOXsAAeYtS.jpg'],
2020-09-23 11:49:44+00:00,pah1974,"ship spotter.posting pics and video's of ships from felixstowe,great yarmouth and sometimes from the Thames.   Also big film fan and most sci-fi stuff.",,OOCL JAPAN departing the port of felixstowe 20/9/20. https://t.co/fBx9sVuMSn,en,,['https://pbs.twimg.com/media/EimPpFPWAAAUlDp.jpg'],
2020-08-28 14:48:59+00:00,pah1974,"ship spotter.posting pics and video's of ships from felixstowe,great yarmouth and sometimes from the Thames.   Also big film fan and most sci-fi stuff.",,Ro-Ro THULELAND passing tilbury fort inbound to Tilbury docks this morning. https://t.co/7qpf0nGj4v,en,,['https://pbs.twimg.com/media/Egg_FCRUYAEDYge.jpg'],
2020-08-28 14:45:43+00:00,pah1974,"ship spotter.posting pics and video's of ships from felixstowe,great yarmouth and sometimes from the Thames.   Also big film fan and most sci-fi stuff.",,MSC MELINE passing tilbury fort this morning @LondonPortAuth https://t.co/ayfcU3ooGX,en,,['https://pbs.twimg.com/media/Egg-ZVsUcAAkafk.jpg'],
2020-08-18 13:17:42+00:00,pah1974,"ship spotter.posting pics and video's of ships from felixstowe,great yarmouth and sometimes from the Thames.   Also big film fan and most sci-fi stuff.",,HMM GDANSK outbound from London Gateway 18/8/20. https://t.co/qxVthH44ww,en,,['https://pbs.twimg.com/media/EftKUu_WoAAKxpt.jpg'],
2020-08-17 15:21:05+00:00,pah1974,"ship spotter.posting pics and video's of ships from felixstowe,great yarmouth and sometimes from the Thames.   Also big film fan and most sci-fi stuff.",,@harwichhaven Anti-pollution boat HAVEN HORNBILL collecting timber from landguard beach at felixstowe 17/8/20. https://t.co/EIzWozBBn0,en,,['https://pbs.twimg.com/media/EfocqkhXoAAPNu0.jpg'],
2020-08-16 06:42:18+00:00,pah1974,"ship spotter.posting pics and video's of ships from felixstowe,great yarmouth and sometimes from the Thames.   Also big film fan and most sci-fi stuff.",,SVITZER KENT testing her fire monitors at the port of felixstowe 15/8/20. https://t.co/VmlxgDPDim,en,,['https://pbs.twimg.com/media/EfhcuI_XkAY2jG8.jpg'],
2020-08-16 06:40:23+00:00,pah1974,"ship spotter.posting pics and video's of ships from felixstowe,great yarmouth and sometimes from the Thames.   Also big film fan and most sci-fi stuff.",,THALASSA AXIA arriving at a misty port of felixstowe 15/8/20. https://t.co/tIzILBz1fC,en,,['https://pbs.twimg.com/media/EfhcWlbXkAIGIDq.jpg'],
2020-07-31 16:06:06+00:00,pah1974,"ship spotter.posting pics and video's of ships from felixstowe,great yarmouth and sometimes from the Thames.   Also big film fan and most sci-fi stuff.",,@SvitzerGlobal SVITZER KENT heads out from the port of felixstowe to meet an incoming ship 29/7/20. https://t.co/eIwj5FaxAU,en,,['https://pbs.twimg.com/media/EeRELZNWoAY6D8b.jpg'],
2020-07-29 15:15:59+00:00,pah1974,"ship spotter.posting pics and video's of ships from felixstowe,great yarmouth and sometimes from the Thames.   Also big film fan and most sci-fi stuff.",,ARKLOW REBEL passing through Harwich Harbour outbound from ipswich 29/7/20. https://t.co/wVnr0gSnEX,en,,['https://pbs.twimg.com/media/EeGlx4IX0AAOYqQ.jpg'],
2020-07-29 15:14:34+00:00,pah1974,"ship spotter.posting pics and video's of ships from felixstowe,great yarmouth and sometimes from the Thames.   Also big film fan and most sci-fi stuff.",,MSC RAVENNA departing the port of felixstowe 29/7/20. https://t.co/vROAshgORA,en,,['https://pbs.twimg.com/media/EeGlTExWsAAj4BQ.jpg'],
2020-07-29 15:12:15+00:00,pah1974,"ship spotter.posting pics and video's of ships from felixstowe,great yarmouth and sometimes from the Thames.   Also big film fan and most sci-fi stuff.",,OOCL HONG KONG arriving at the port of felixstowe 29/7/20. https://t.co/JxoxyQ29Sn,en,,['https://pbs.twimg.com/media/EeGkib4XkAEZT0j.jpg'],
2020-07-29 12:48:43+00:00,pah1974,"ship spotter.posting pics and video's of ships from felixstowe,great yarmouth and sometimes from the Thames.   Also big film fan and most sci-fi stuff.",,Thames sailing barge IRONSIDES passing through Harwich Harbour this morning. https://t.co/ephGrKzfef,en,,['https://pbs.twimg.com/media/EeGEDHOWoAAMgHl.jpg'],
2020-07-24 08:00:35+00:00,pah1974,"ship spotter.posting pics and video's of ships from felixstowe,great yarmouth and sometimes from the Thames.   Also big film fan and most sci-fi stuff.",,Tug RT AMBITION passing tilbury fort 23/7/20. https://t.co/xwUdrAdIOp,en,,['https://pbs.twimg.com/media/EdrRc8XWkAA9VEl.jpg'],
2020-07-24 07:54:52+00:00,pah1974,"ship spotter.posting pics and video's of ships from felixstowe,great yarmouth and sometimes from the Thames.   Also big film fan and most sci-fi stuff.",,Thames pilot boat LEADER passing tilbury 23/7/20. https://t.co/CJ4BhR9O0L,en,,['https://pbs.twimg.com/media/EdrQ41oX0AAdw4c.jpg'],
2020-07-23 15:56:52+00:00,pah1974,"ship spotter.posting pics and video's of ships from felixstowe,great yarmouth and sometimes from the Thames.   Also big film fan and most sci-fi stuff.",,BLUE SAPPHIRE (Ex Saga Sapphire) outbound from tilbury docks after lay up and name change and heading for Gibraltar. https://t.co/BN0vOVxwYT,en,,['https://pbs.twimg.com/media/Edn1Fo2XgAAmzEp.jpg'],
2020-07-14 09:35:17+00:00,pah1974,"ship spotter.posting pics and video's of ships from felixstowe,great yarmouth and sometimes from the Thames.   Also big film fan and most sci-fi stuff.",,VOS PRELUDE arriving at Great Yarmouth and backing down the river 13/7/20. https://t.co/UyN0MJmZBV,en,,['https://pbs.twimg.com/media/Ec4HyO1XkAEMkh-.jpg'],
2020-07-14 09:32:37+00:00,pah1974,"ship spotter.posting pics and video's of ships from felixstowe,great yarmouth and sometimes from the Thames.   Also big film fan and most sci-fi stuff.",,Offshore supply vessel HIGHLAND KNIGHT arriving at Great Yarmouth 13/7/20. https://t.co/0DRx57FFGo,en,,['https://pbs.twimg.com/media/Ec4HTjXXgAE81ds.jpg'],
2020-07-14 09:30:44+00:00,pah1974,"ship spotter.posting pics and video's of ships from felixstowe,great yarmouth and sometimes from the Thames.   Also big film fan and most sci-fi stuff.",,PUTFORD VIKING arriving at Great Yarmouth 13/7/20. https://t.co/2GwaJL4nlB,en,,['https://pbs.twimg.com/media/Ec4G7Q6XsAUYfD4.jpg'],
2020-07-13 14:56:16+00:00,pah1974,"ship spotter.posting pics and video's of ships from felixstowe,great yarmouth and sometimes from the Thames.   Also big film fan and most sci-fi stuff.",,"RT @Alyssa_Milano: Thanks, @DadoftheDecade. This is perfect. And sad. https://t.co/8WAd2C0Fl8",en,,['https://pbs.twimg.com/ext_tw_video_thumb/1282509141970350080/pu/img/AhaTf3Gudwha0oXA.jpg'],
2020-07-13 14:37:47+00:00,pah1974,"ship spotter.posting pics and video's of ships from felixstowe,great yarmouth and sometimes from the Thames.   Also big film fan and most sci-fi stuff.",,Standby safety vessel VOS TRADER arriving at Great Yarmouth in the morning sunshine 13/7/20. https://t.co/s2FEGnBsug,en,,['https://pbs.twimg.com/media/Ec0DboyXYAEx5FI.jpg'],
2020-07-07 16:06:27+00:00,pah1974,"ship spotter.posting pics and video's of ships from felixstowe,great yarmouth and sometimes from the Thames.   Also big film fan and most sci-fi stuff.",,Safety Boat Services SBS BREAKWATER at Lowestoft 4/7/20. https://t.co/5Qtftg7An6,en,,['https://pbs.twimg.com/media/EcVdf9OWoAA7RVv.jpg'],
2020-07-07 16:00:00+00:00,pah1974,"ship spotter.posting pics and video's of ships from felixstowe,great yarmouth and sometimes from the Thames.   Also big film fan and most sci-fi stuff.",,@briggsmarine HUMBER GUARDIAN at Lowestoft 4/7/20. https://t.co/waltfgMAG9,en,,['https://pbs.twimg.com/media/EcVcVN4XgAAxkxg.jpg'],
2020-07-04 14:24:38+00:00,pah1974,"ship spotter.posting pics and video's of ships from felixstowe,great yarmouth and sometimes from the Thames.   Also big film fan and most sci-fi stuff.",,Cruise ship QUEEN VICTORIA anchored off the Suffolk coast near Lowestoft 4/7/20. https://t.co/SGO0qbqgZW,en,,['https://pbs.twimg.com/media/EcFqIf4WAAEF5eC.jpg'],
2020-06-26 14:56:44+00:00,pah1974,"ship spotter.posting pics and video's of ships from felixstowe,great yarmouth and sometimes from the Thames.   Also big film fan and most sci-fi stuff.",,MP THE BRADY inbound for the port of felixstowe 25/6/20. https://t.co/UH0yzSjFsF,en,,['https://pbs.twimg.com/media/Ebck9elWsAAVhxn.jpg'],
2020-06-26 14:55:31+00:00,pah1974,"ship spotter.posting pics and video's of ships from felixstowe,great yarmouth and sometimes from the Thames.   Also big film fan and most sci-fi stuff.",,MSC KRYSTAL departing the port of felixstowe 25/6/20. https://t.co/pCLLj0nmoW,en,,['https://pbs.twimg.com/media/EbckpkLXsAARmyv.jpg'],
2020-06-26 14:53:51+00:00,pah1974,"ship spotter.posting pics and video's of ships from felixstowe,great yarmouth and sometimes from the Thames.   Also big film fan and most sci-fi stuff.",,VUOKSI MAERSK outbound from the port of felixstowe 25/6/20. https://t.co/g19YZihKup,en,,['https://pbs.twimg.com/media/EbckSi-WkAEw6BE.jpg'],
2020-05-30 09:54:25+00:00,pah1974,"ship spotter.posting pics and video's of ships from felixstowe,great yarmouth and sometimes from the Thames.   Also big film fan and most sci-fi stuff.",,BigLift ship HAPPY BUCCANEER outbound from Harwich navy yard 29/5/20. https://t.co/USnCbs9waG,en,,['https://pbs.twimg.com/media/EZQcjN5XgAA7OFU.jpg'],
2020-05-27 16:44:29+00:00,pah1974,"ship spotter.posting pics and video's of ships from felixstowe,great yarmouth and sometimes from the Thames.   Also big film fan and most sci-fi stuff.",,Small tug GRAY TEST departs ipswich heading back to the Port of Felixstowe 19/5/20. https://t.co/IBE1tNke90,en,,['https://pbs.twimg.com/media/EZCdwLqWkAIKB-N.jpg'],
2020-05-27 16:13:17+00:00,pah1974,"ship spotter.posting pics and video's of ships from felixstowe,great yarmouth and sometimes from the Thames.   Also big film fan and most sci-fi stuff.",,VICTRESS at the port of ipswich 19/5/20. https://t.co/YxDRfC4wE1,en,,['https://pbs.twimg.com/media/EZCWyXsXsAI7tRH.jpg'],
2020-05-26 12:00:27+00:00,pah1974,"ship spotter.posting pics and video's of ships from felixstowe,great yarmouth and sometimes from the Thames.   Also big film fan and most sci-fi stuff.",,WILSON PERTH (Ex ARKLOW RESOLVE) departing the port of ipswich 19/5/20. https://t.co/ZesV3N4pZN,en,,['https://pbs.twimg.com/media/EY8TN3bXsAEBVqw.jpg'],
2020-05-26 11:58:34+00:00,pah1974,"ship spotter.posting pics and video's of ships from felixstowe,great yarmouth and sometimes from the Thames.   Also big film fan and most sci-fi stuff.",,138m length SIDER LIU (with tug GRAY TEST) heads up the river orwell for ipswich 19/5/20. https://t.co/7eYwV1yD8T,en,,['https://pbs.twimg.com/media/EY8SaSsXgAIOET2.jpg'],
2020-03-18 13:56:52+00:00,pah1974,"ship spotter.posting pics and video's of ships from felixstowe,great yarmouth and sometimes from the Thames.   Also big film fan and most sci-fi stuff.",,MEHMET DADAYLI-1 berthed at the port of ipswich 17/3/20. https://t.co/Bxa5SnuVTj,en,,['https://pbs.twimg.com/media/ETZYK0YXsAAJNVZ.jpg'],
2020-03-13 11:12:17+00:00,pah1974,"ship spotter.posting pics and video's of ships from felixstowe,great yarmouth and sometimes from the Thames.   Also big film fan and most sci-fi stuff.",,AASLI passing through Harwich Harbour outbound from ipswich 11/3/20. https://t.co/0Pp54vRvER,en,,['https://pbs.twimg.com/media/ES_CmmhWsAExnH0.jpg'],
2020-03-13 11:10:15+00:00,pah1974,"ship spotter.posting pics and video's of ships from felixstowe,great yarmouth and sometimes from the Thames.   Also big film fan and most sci-fi stuff.",,Tanker ARDEA passing through Harwich Harbour outbound from Harwich 11/3/20. https://t.co/IIyCyALW1i,en,,['https://pbs.twimg.com/media/ES_CER5XsAEO-Uk.jpg'],
2020-03-13 11:07:49+00:00,pah1974,"ship spotter.posting pics and video's of ships from felixstowe,great yarmouth and sometimes from the Thames.   Also big film fan and most sci-fi stuff.",,EVER GRADE at the port of felixstowe 11/3/20. https://t.co/IXrfEHIHUx,en,,['https://pbs.twimg.com/media/ES_BoK4XQAEIq9u.jpg'],
2020-03-08 10:51:25+00:00,pah1974,"ship spotter.posting pics and video's of ships from felixstowe,great yarmouth and sometimes from the Thames.   Also big film fan and most sci-fi stuff.",,"RT @Milestoner1: FRIDTJOF NANSEN departure from Tilbury 7-3-2020

@jason_photos @pah1974 @2000MX5 @wavecrestglen https://t.co/EVdHsWNfhM",no,,['https://pbs.twimg.com/ext_tw_video_thumb/1236411540259119104/pu/img/vpcHEZZuSeAhdZIL.jpg'],
2020-02-19 17:21:06+00:00,pah1974,"ship spotter.posting pics and video's of ships from felixstowe,great yarmouth and sometimes from the Thames.   Also big film fan and most sci-fi stuff.",,MAPLE departing the port of ipswich around 12:50pm this afternoon after waiting for the 2 inbound vessels to berth. https://t.co/YgUwQVOskf,en,,['https://pbs.twimg.com/media/ERJ6KnRWsAIh3B5.jpg'],
2020-02-19 17:17:55+00:00,pah1974,"ship spotter.posting pics and video's of ships from felixstowe,great yarmouth and sometimes from the Thames.   Also big film fan and most sci-fi stuff.",,ROSE also heading up the river orwell for ipswich this morning. https://t.co/PX7nk0BR27,en,,['https://pbs.twimg.com/media/ERJ5pOaWAAAig4T.jpg'],
2020-02-19 17:15:54+00:00,pah1974,"ship spotter.posting pics and video's of ships from felixstowe,great yarmouth and sometimes from the Thames.   Also big film fan and most sci-fi stuff.",,KETHI heading up the river orwell for the port of ipswich this morning. https://t.co/RRIxSiCY9R,en,,['https://pbs.twimg.com/media/ERJ5LdlW4AA8U4t.jpg'],
2020-02-19 16:48:10+00:00,pah1974,"ship spotter.posting pics and video's of ships from felixstowe,great yarmouth and sometimes from the Thames.   Also big film fan and most sci-fi stuff.",,399m length EVER GREET at the port of felixstowe this morning. https://t.co/6ENTCBJnXJ,en,,['https://pbs.twimg.com/media/ERJy3CQW4AIX51Q.jpg'],
2020-02-14 18:41:59+00:00,pah1974,"ship spotter.posting pics and video's of ships from felixstowe,great yarmouth and sometimes from the Thames.   Also big film fan and most sci-fi stuff.",,AST MALTA heading into the port of ipswich just after 4pm the afternoon. https://t.co/TaAa2pokWm,en,,['https://pbs.twimg.com/media/EQwdNmHWoAote5k.jpg'],
2020-02-08 09:34:16+00:00,pah1974,"ship spotter.posting pics and video's of ships from felixstowe,great yarmouth and sometimes from the Thames.   Also big film fan and most sci-fi stuff.",,Coaster PAPER MOON passing through Harwich Harbour heading for ipswich 5/2/20. https://t.co/tJULfrcHTU,en,,['https://pbs.twimg.com/media/EQPmT2RW4AAntYJ.jpg'],
2020-02-07 09:14:15+00:00,pah1974,"ship spotter.posting pics and video's of ships from felixstowe,great yarmouth and sometimes from the Thames.   Also big film fan and most sci-fi stuff.",,STENA HOLLANDICA outbound from Harwich 5/2/20. https://t.co/M6rlEhjea4,en,,['https://pbs.twimg.com/media/EQKYI4HXsAExplR.jpg'],
2020-02-07 09:11:07+00:00,pah1974,"ship spotter.posting pics and video's of ships from felixstowe,great yarmouth and sometimes from the Thames.   Also big film fan and most sci-fi stuff.",,Coaster FAST WIL passing through Harwich Harbour outbound from mistley 5/2/20. https://t.co/bHM9XA2FKu,en,,['https://pbs.twimg.com/media/EQKXbH5W4AALuND.jpg'],
2020-02-07 09:00:11+00:00,pah1974,"ship spotter.posting pics and video's of ships from felixstowe,great yarmouth and sometimes from the Thames.   Also big film fan and most sci-fi stuff.",,Dredger JAMES COOK working off felixstowe's berth9 in the sunshine 5/2/20. https://t.co/sjP0oeHrIR,en,,['https://pbs.twimg.com/media/EQKU6hbWsAA1yma.jpg'],
2020-01-23 15:32:35+00:00,pah1974,"ship spotter.posting pics and video's of ships from felixstowe,great yarmouth and sometimes from the Thames.   Also big film fan and most sci-fi stuff.",,A smoky ARKLOW FUTURE also heading up the river orwell for the port of ipswich 23/1/20. https://t.co/KqNeNiq62r,en,,['https://pbs.twimg.com/media/EO-e4-eWkAEU28_.jpg'],
2020-01-23 15:28:54+00:00,pah1974,"ship spotter.posting pics and video's of ships from felixstowe,great yarmouth and sometimes from the Thames.   Also big film fan and most sci-fi stuff.",,ARKLOW RAVEN heading up the river orwell for the port of ipswich 23/1/20. https://t.co/wwXshE22gC,en,,['https://pbs.twimg.com/media/EO-eC54X0AIP_KF.jpg'],
2019-11-13 20:24:06+00:00,pah1974,"ship spotter.posting pics and video's of ships from felixstowe,great yarmouth and sometimes from the Thames.   Also big film fan and most sci-fi stuff.",,COSCO SHIPPING ANDES departing the port of felixstowe 13/11/19. https://t.co/cJ21vsavap,en,,['https://pbs.twimg.com/media/EJR4uarXkAMXxHt.jpg'],
2019-11-13 15:49:28+00:00,pah1974,"ship spotter.posting pics and video's of ships from felixstowe,great yarmouth and sometimes from the Thames.   Also big film fan and most sci-fi stuff.",,Offshore support vessel ACTA ORION heading for the port of Harwich 13/11/19. https://t.co/Bo3amBK91L,en,,['https://pbs.twimg.com/media/EJQ53a5W4AIm15B.jpg'],
2019-11-10 11:01:33+00:00,pah1974,"ship spotter.posting pics and video's of ships from felixstowe,great yarmouth and sometimes from the Thames.   Also big film fan and most sci-fi stuff.",,Feeder ship SPICA J arriving in harwich harbour this morning for her 1st call at the port of felixstowe. https://t.co/luhz6l8f3z,en,,['https://pbs.twimg.com/media/EJAbMyTXsAAiAGW.jpg'],
2019-11-10 10:59:14+00:00,pah1974,"ship spotter.posting pics and video's of ships from felixstowe,great yarmouth and sometimes from the Thames.   Also big film fan and most sci-fi stuff.",,Offshore support vessel BOKA DA VINCI heading for Harwich this morning. https://t.co/lru7CrwFUj,en,,['https://pbs.twimg.com/media/EJAaq57XYAEHnCq.jpg'],
2019-11-06 12:55:08+00:00,pah1974,"ship spotter.posting pics and video's of ships from felixstowe,great yarmouth and sometimes from the Thames.   Also big film fan and most sci-fi stuff.",,MARGRETHE MAERSK arriving at the port of felixstowe 5/11/19. https://t.co/XwKDlyKdyJ,en,,['https://pbs.twimg.com/media/EIsO1qZX0AAGNcJ.jpg'],
2019-11-06 12:52:43+00:00,pah1974,"ship spotter.posting pics and video's of ships from felixstowe,great yarmouth and sometimes from the Thames.   Also big film fan and most sci-fi stuff.",,Coaster PATRON sailing up the river orwell for the port of ipswich 4/11/19. https://t.co/frBeSJiLSy,en,,['https://pbs.twimg.com/media/EIsOSZQXsAUR5_k.jpg'],
2019-11-06 12:50:49+00:00,pah1974,"ship spotter.posting pics and video's of ships from felixstowe,great yarmouth and sometimes from the Thames.   Also big film fan and most sci-fi stuff.",,ARKLOW FAME berthed at the port of ipswich 4/11/19. https://t.co/JZ7D75wbTB,en,,['https://pbs.twimg.com/media/EIsN0P9XYAY4vRj.jpg'],
2019-09-27 14:50:33+00:00,pah1974,"ship spotter.posting pics and video's of ships from felixstowe,great yarmouth and sometimes from the Thames.   Also big film fan and most sci-fi stuff.",,"RT @2000MX5: Almost missed this.
Enjoy!  https://t.co/vDhS4hEycb",en,,['https://pbs.twimg.com/ext_tw_video_thumb/1177592781600149504/pu/img/fCH6tZ5j9YdLdP9W.jpg'],
2019-09-18 07:16:57+00:00,pah1974,"ship spotter.posting pics and video's of ships from felixstowe,great yarmouth and sometimes from the Thames.   Also big film fan and most sci-fi stuff.",,Windfarm workboat TMS BITTERN arriving back at Great Yarmouth 17/9/19. https://t.co/pYYq0n5n9q,en,,['https://pbs.twimg.com/media/EEurirPX4AE19H9.jpg'],
2019-09-18 07:15:08+00:00,pah1974,"ship spotter.posting pics and video's of ships from felixstowe,great yarmouth and sometimes from the Thames.   Also big film fan and most sci-fi stuff.",,Offshore supply vessel OLYMPIC ELECTRA arriving at Great Yarmouth and backing down the river 17/9/19. https://t.co/YYnoODUYYW,en,,['https://pbs.twimg.com/media/EEurIKgXsAILFXR.jpg'],
2019-09-17 20:45:11+00:00,pah1974,"ship spotter.posting pics and video's of ships from felixstowe,great yarmouth and sometimes from the Thames.   Also big film fan and most sci-fi stuff.",,Offshore supply vessel HIGHLAND KNIGHT arriving at Great Yarmouth 17/9/19. https://t.co/LhqwfNUk8N,en,,['https://pbs.twimg.com/media/EEsa8VmXsAAH3CE.jpg'],
2019-09-17 20:28:12+00:00,pah1974,"ship spotter.posting pics and video's of ships from felixstowe,great yarmouth and sometimes from the Thames.   Also big film fan and most sci-fi stuff.",,NOORTRUCK arriving at Great Yarmouth 17/9/19. https://t.co/dztglNHros,en,,['https://pbs.twimg.com/media/EEsXDUkWwAQrOTk.jpg'],
2019-09-17 20:23:58+00:00,pah1974,"ship spotter.posting pics and video's of ships from felixstowe,great yarmouth and sometimes from the Thames.   Also big film fan and most sci-fi stuff.",,cruise ship BALMORAL arriving off Great Yarmouth heading for the outer harbour 17/9/19. https://t.co/wm25PPGQj2,en,,['https://pbs.twimg.com/media/EEsWFaqXYAIidfC.jpg'],
2019-09-08 19:46:12+00:00,pah1974,"ship spotter.posting pics and video's of ships from felixstowe,great yarmouth and sometimes from the Thames.   Also big film fan and most sci-fi stuff.",,Another pic of the world's largest container ship MSC GULSUN departing felixstowe 7/9/19. https://t.co/KXrzpv3ALM,en,,['https://pbs.twimg.com/media/ED93IUFXUAEqZNa.jpg'],
2019-09-08 10:15:49+00:00,pah1974,"ship spotter.posting pics and video's of ships from felixstowe,great yarmouth and sometimes from the Thames.   Also big film fan and most sci-fi stuff.",,Tanker SHANNON FISHER outbound from Harwich 7/9/19. https://t.co/wFY8gfnrBV,en,,['https://pbs.twimg.com/media/ED70k8MXoAE390w.jpg'],
2019-09-08 10:14:26+00:00,pah1974,"ship spotter.posting pics and video's of ships from felixstowe,great yarmouth and sometimes from the Thames.   Also big film fan and most sci-fi stuff.",,MSC GULSUN - worlds largest container ship departing felixstowe 7/9/19. https://t.co/vTdlqGXRJa,en,,['https://pbs.twimg.com/media/ED70QqOW4AALAtT.jpg'],
2019-09-02 14:13:20+00:00,pah1974,"ship spotter.posting pics and video's of ships from felixstowe,great yarmouth and sometimes from the Thames.   Also big film fan and most sci-fi stuff.",,Tanker STOLT KINGFISHER outbound from Harwich 31/8/19. https://t.co/tsWDVo7b2a,en,,['https://pbs.twimg.com/media/EDdxZj4WwAAU7Og.jpg'],
2019-09-02 14:11:19+00:00,pah1974,"ship spotter.posting pics and video's of ships from felixstowe,great yarmouth and sometimes from the Thames.   Also big film fan and most sci-fi stuff.",,OOCL HONG KONG departing the port of felixstowe 31/8/19. https://t.co/C12IO4BtPd,en,,['https://pbs.twimg.com/media/EDdw7GoXkAAh8-9.jpg'],
2019-07-31 08:42:29+00:00,pah1974,"ship spotter.posting pics and video's of ships from felixstowe,great yarmouth and sometimes from the Thames.   Also big film fan and most sci-fi stuff.",,Coaster GOMERA also departs ipswich heading for szczecin in poland 30/7/19. https://t.co/eOV47ofoA7,ro,,['https://pbs.twimg.com/media/EAypNibXUAEJuBK.jpg'],
2019-07-31 08:39:33+00:00,pah1974,"ship spotter.posting pics and video's of ships from felixstowe,great yarmouth and sometimes from the Thames.   Also big film fan and most sci-fi stuff.",,"Coaster FRI OCEAN departing ipswich and heads for Boston,lincolnshire UK 30/7/19. https://t.co/cb6BduD2Z5",en,,['https://pbs.twimg.com/media/EAyoiRiXkAAHmNe.jpg'],
2019-07-31 08:33:47+00:00,pah1974,"ship spotter.posting pics and video's of ships from felixstowe,great yarmouth and sometimes from the Thames.   Also big film fan and most sci-fi stuff.",,SVITZER SKY departing ipswich and heading back down to the port of felixstowe 30/7/19. https://t.co/qxzB5Lnua5,en,,['https://pbs.twimg.com/media/EAynNxoXoAADvbB.jpg'],
2019-07-31 08:30:41+00:00,pah1974,"ship spotter.posting pics and video's of ships from felixstowe,great yarmouth and sometimes from the Thames.   Also big film fan and most sci-fi stuff.",,Tanker ACQUAMARINA with svitzer sky heading up the river orwell to the port of ipswich 30/7/19. https://t.co/UCbDqEadkF,en,,['https://pbs.twimg.com/media/EAymgUtW4AAnz6W.jpg'],
2019-07-29 17:12:16+00:00,pah1974,"ship spotter.posting pics and video's of ships from felixstowe,great yarmouth and sometimes from the Thames.   Also big film fan and most sci-fi stuff.",,ML FREYJA heading for the old navy yard at Harwich 5/7/19. https://t.co/wxmYMKYms5,en,,['https://pbs.twimg.com/media/EAqKtw7XoAM0mWr.jpg'],
2019-07-29 17:05:19+00:00,pah1974,"ship spotter.posting pics and video's of ships from felixstowe,great yarmouth and sometimes from the Thames.   Also big film fan and most sci-fi stuff.",,COSCO SHIPPING AQUARIUS on her maiden arrival at felixstowe 11/7/19. https://t.co/AawQ6ZZScu,en,,['https://pbs.twimg.com/media/EAqJHu7WwAAGr31.jpg'],
2019-07-29 17:01:14+00:00,pah1974,"ship spotter.posting pics and video's of ships from felixstowe,great yarmouth and sometimes from the Thames.   Also big film fan and most sci-fi stuff.",,@SvitzerGlobal Svitzer Kent heads out at felixstowe 13/7/19. https://t.co/YmGZqPcYjK,en,,['https://pbs.twimg.com/media/EAqILtWXYAEfRc6.jpg'],
2019-07-29 16:58:47+00:00,pah1974,"ship spotter.posting pics and video's of ships from felixstowe,great yarmouth and sometimes from the Thames.   Also big film fan and most sci-fi stuff.",,STENA HOLLANDICA outbound from Harwich 13/7/19. https://t.co/avNH8qmuKx,en,,['https://pbs.twimg.com/media/EAqHnsNXkAAA_Ri.jpg'],
2019-07-29 16:56:42+00:00,pah1974,"ship spotter.posting pics and video's of ships from felixstowe,great yarmouth and sometimes from the Thames.   Also big film fan and most sci-fi stuff.",,MALIY B.S. heading up the river orwell for @abports21 ipswich 15/7/19. https://t.co/nfOja3yokd,en,,['https://pbs.twimg.com/media/EAqHJffWkAAXDPW.jpg'],
2019-07-29 16:53:58+00:00,pah1974,"ship spotter.posting pics and video's of ships from felixstowe,great yarmouth and sometimes from the Thames.   Also big film fan and most sci-fi stuff.",,Coaster HEYN heading up the river orwell for port of ipswich 15/7/19. https://t.co/r5UuBbllJ2,en,,['https://pbs.twimg.com/media/EAqGhe0WwAEXUsD.jpg'],
2019-07-29 16:51:35+00:00,pah1974,"ship spotter.posting pics and video's of ships from felixstowe,great yarmouth and sometimes from the Thames.   Also big film fan and most sci-fi stuff.",,Cable laying vessel ISAAC NEWTON heading for Harwich 18/7/19 https://t.co/AU5zDuxfQ8,en,,['https://pbs.twimg.com/media/EAqF-fPXsAAeLLr.jpg'],
2019-07-29 16:49:38+00:00,pah1974,"ship spotter.posting pics and video's of ships from felixstowe,great yarmouth and sometimes from the Thames.   Also big film fan and most sci-fi stuff.",,Ice-class VENTA MAERSK leaving felixstowe 18/7/19. https://t.co/72TVoVwAkM,en,,['https://pbs.twimg.com/media/EAqFhj3WkAAkdsi.jpg'],
2019-07-29 16:46:48+00:00,pah1974,"ship spotter.posting pics and video's of ships from felixstowe,great yarmouth and sometimes from the Thames.   Also big film fan and most sci-fi stuff.",,Tug/workboat AFON LLIGWY working off berth9 at felixstowe 18/7/19. https://t.co/w0BJHVRWmk,en,,['https://pbs.twimg.com/media/EAqE4esXYAE1w_h.jpg'],
2019-07-29 16:43:19+00:00,pah1974,"ship spotter.posting pics and video's of ships from felixstowe,great yarmouth and sometimes from the Thames.   Also big film fan and most sci-fi stuff.",,COSCO SHIPPING ROSE arriving on her 1st call at felixstowe 22/7/19. https://t.co/6uPLyVNtBR,en,,['https://pbs.twimg.com/media/EAqEEpyXsAA4O-M.jpg'],
2019-07-29 16:40:59+00:00,pah1974,"ship spotter.posting pics and video's of ships from felixstowe,great yarmouth and sometimes from the Thames.   Also big film fan and most sci-fi stuff.",,EVER GENIUS departing the port of felixstowe 22/7/19. https://t.co/DUYOjrWbv5,en,,['https://pbs.twimg.com/media/EAqDjB1XsAAXNIw.jpg'],
2019-07-15 18:09:31+00:00,pah1974,"ship spotter.posting pics and video's of ships from felixstowe,great yarmouth and sometimes from the Thames.   Also big film fan and most sci-fi stuff.",,@OrwellLady heading back to ipswich at 12:30 this afternoon 15/7/19. https://t.co/WN2TtitB52,en,,['https://pbs.twimg.com/media/D_iRdNDXkAA1phb.jpg'],
2019-05-22 19:47:21+00:00,pah1974,"ship spotter.posting pics and video's of ships from felixstowe,great yarmouth and sometimes from the Thames.   Also big film fan and most sci-fi stuff.",,Multicat workboat PANDA outbound from Harwich 16/5/19 https://t.co/0z9iia3uuO,en,,['https://pbs.twimg.com/media/D7MiGByXsAAsEhW.jpg'],
2019-05-22 19:42:45+00:00,pah1974,"ship spotter.posting pics and video's of ships from felixstowe,great yarmouth and sometimes from the Thames.   Also big film fan and most sci-fi stuff.",,VAYENGA MAERSK at felixstowe 16/5/19. https://t.co/87vCMMzuTG,cy,,['https://pbs.twimg.com/media/D7MhCoXXoAENBB2.jpg'],
2019-05-22 19:40:18+00:00,pah1974,"ship spotter.posting pics and video's of ships from felixstowe,great yarmouth and sometimes from the Thames.   Also big film fan and most sci-fi stuff.",,Offshore support/supply vessel SEABED WORKER heading out from Harwich 16/5/19. https://t.co/cZolXLdRgW,en,,['https://pbs.twimg.com/media/D7Mget7XoAAUysp.jpg'],
2019-05-22 19:38:04+00:00,pah1974,"ship spotter.posting pics and video's of ships from felixstowe,great yarmouth and sometimes from the Thames.   Also big film fan and most sci-fi stuff.",,OOCL UNITED KINGDOM along side berth9 at Port of Felixstowe 16/5/19. https://t.co/DMKbRFPf0L,en,,['https://pbs.twimg.com/media/D7Mf9j9XoAULmoe.jpg'],
2019-05-22 12:39:11+00:00,pah1974,"ship spotter.posting pics and video's of ships from felixstowe,great yarmouth and sometimes from the Thames.   Also big film fan and most sci-fi stuff.",,Sailing barge VICTOR heading back to ipswich 12/5/19. https://t.co/BVliqViV4l,en,,['https://pbs.twimg.com/media/D7LAFKiX4AIUNyA.jpg'],
2019-05-22 12:35:51+00:00,pah1974,"ship spotter.posting pics and video's of ships from felixstowe,great yarmouth and sometimes from the Thames.   Also big film fan and most sci-fi stuff.",,VALENTINA heading into the port of ipswich 12/5/19. https://t.co/UtbIMcy5st,en,,['https://pbs.twimg.com/media/D7K_VfZXkAE664-.jpg'],
2019-05-22 12:31:06+00:00,pah1974,"ship spotter.posting pics and video's of ships from felixstowe,great yarmouth and sometimes from the Thames.   Also big film fan and most sci-fi stuff.",,Tug GRAY TEST departs ipswich and heads back to the port of felixstowe 8/5/19. https://t.co/dIa0gzh0tu,en,,['https://pbs.twimg.com/media/D7K-PBpW0AE6AjT.jpg'],
2019-05-22 12:28:53+00:00,pah1974,"ship spotter.posting pics and video's of ships from felixstowe,great yarmouth and sometimes from the Thames.   Also big film fan and most sci-fi stuff.",,SORMOVSKIY 3060 berthed at ipswich 8/5/19 https://t.co/r85pGE82Vk,en,,['https://pbs.twimg.com/media/D7K9vR1XsAA3o3I.jpg'],
2019-05-22 12:28:47+00:00,pah1974,"ship spotter.posting pics and video's of ships from felixstowe,great yarmouth and sometimes from the Thames.   Also big film fan and most sci-fi stuff.",,PAPER MOON at Ipswich 8/5/19 https://t.co/fyW0CU15Gr,en,,['https://pbs.twimg.com/media/D7K9tyJW4AAorHw.jpg'],
2019-05-22 12:25:15+00:00,pah1974,"ship spotter.posting pics and video's of ships from felixstowe,great yarmouth and sometimes from the Thames.   Also big film fan and most sci-fi stuff.",,TIWALA berthed at ipswich 8/5/19 https://t.co/UaQj6LhTNA,tl,,['https://pbs.twimg.com/media/D7K8561WwAYOkip.jpg'],
2019-05-22 12:19:04+00:00,pah1974,"ship spotter.posting pics and video's of ships from felixstowe,great yarmouth and sometimes from the Thames.   Also big film fan and most sci-fi stuff.",,Oil/chemical tanker SAPPHIRE with tugs gray salvor and gray test heading into the port of ipswich 8/5/19. https://t.co/d7T2erXmKe,en,,['https://pbs.twimg.com/media/D7K7fkeXkAAMaJW.jpg'],
2019-04-29 11:11:35+00:00,pah1974,"ship spotter.posting pics and video's of ships from felixstowe,great yarmouth and sometimes from the Thames.   Also big film fan and most sci-fi stuff.",,OOCL SCANDINAVIA backing up to berth at felixstowe 24/4/19. https://t.co/15Rsaedh3N,en,,['https://pbs.twimg.com/media/D5UPfDiWkAE0Jba.jpg'],
2019-04-29 11:08:38+00:00,pah1974,"ship spotter.posting pics and video's of ships from felixstowe,great yarmouth and sometimes from the Thames.   Also big film fan and most sci-fi stuff.",,AAL KOBE berthed at felixstowe 24/4/19 https://t.co/FTvtrJLuvz,en,,['https://pbs.twimg.com/media/D5UOznKWsAEix15.jpg'],
2019-03-13 15:50:39+00:00,pah1974,"ship spotter.posting pics and video's of ships from felixstowe,great yarmouth and sometimes from the Thames.   Also big film fan and most sci-fi stuff.",,MADISON MAERSK and EVER GOODS berthed at felixstowe 12/3/19. https://t.co/SGTJNOgvvG,en,,['https://pbs.twimg.com/media/D1jMdHEX4AAnkIx.jpg'],
2019-03-13 15:48:01+00:00,pah1974,"ship spotter.posting pics and video's of ships from felixstowe,great yarmouth and sometimes from the Thames.   Also big film fan and most sci-fi stuff.",,tanker CHEMICAL PROVIDER outbound from harwich 12/3/19 https://t.co/5i27VIC7PG,en,,['https://pbs.twimg.com/media/D1jL5x4WkAAuyrS.jpg'],
2019-03-13 15:46:15+00:00,pah1974,"ship spotter.posting pics and video's of ships from felixstowe,great yarmouth and sometimes from the Thames.   Also big film fan and most sci-fi stuff.",,offshore supply vessels SIEM RUBY and OLYMPIC DELTA heading to harwich in the windy conditions 12/3/19. https://t.co/U3oDKIVcHw,en,,['https://pbs.twimg.com/media/D1jLURYWwAAN0Eb.jpg'],
2019-03-07 10:11:39+00:00,pah1974,"ship spotter.posting pics and video's of ships from felixstowe,great yarmouth and sometimes from the Thames.   Also big film fan and most sci-fi stuff.",,SORMOVSKIY 3067 departing Ipswich 6/3/19. https://t.co/Lp1OqSkgO5,en,,['https://pbs.twimg.com/media/D1DFfxSWoAUAYFu.jpg'],
2019-03-07 10:09:46+00:00,pah1974,"ship spotter.posting pics and video's of ships from felixstowe,great yarmouth and sometimes from the Thames.   Also big film fan and most sci-fi stuff.",,KUPER at the old power station berth at Ipswich 6/3/19. https://t.co/MJSr16VOce,en,,['https://pbs.twimg.com/media/D1DFEz8WsAAr2RJ.jpg'],
2019-03-07 10:08:05+00:00,pah1974,"ship spotter.posting pics and video's of ships from felixstowe,great yarmouth and sometimes from the Thames.   Also big film fan and most sci-fi stuff.",,FAST SUS berthed at Ipswich 6/3/19. https://t.co/BJQrXhAwf3,en,,['https://pbs.twimg.com/media/D1DEsPlWkAIhZ4O.jpg'],
2019-03-07 10:01:45+00:00,pah1974,"ship spotter.posting pics and video's of ships from felixstowe,great yarmouth and sometimes from the Thames.   Also big film fan and most sci-fi stuff.",,MONTE AZUL departing felixstowe for antwerp 5/3/19. https://t.co/Wpti1sUKmp,en,,['https://pbs.twimg.com/media/D1DDPD6XgAANTMU.jpg'],
2019-03-02 14:18:06+00:00,pah1974,"ship spotter.posting pics and video's of ships from felixstowe,great yarmouth and sometimes from the Thames.   Also big film fan and most sci-fi stuff.",,Offshore supply vessel FAR SITELLA berthed at Great Yarmouth 1/3/19 https://t.co/rHZKU5OQzE,en,,['https://pbs.twimg.com/media/D0qN9wkXcAA3nyk.jpg'],
2019-03-02 13:53:08+00:00,pah1974,"ship spotter.posting pics and video's of ships from felixstowe,great yarmouth and sometimes from the Thames.   Also big film fan and most sci-fi stuff.",,Tug EMS BOXER heads into Great Yarmouth 1/3/19 https://t.co/hBoTtbjTUO,en,,['https://pbs.twimg.com/media/D0qIQAiWwAExd3l.jpg'],
2019-03-02 13:51:34+00:00,pah1974,"ship spotter.posting pics and video's of ships from felixstowe,great yarmouth and sometimes from the Thames.   Also big film fan and most sci-fi stuff.",,Tug EMS BOXER leading VIKING AMBER into Great Yarmouth's outer harbour 1/3/19. https://t.co/ziae4W6eRb,en,,['https://pbs.twimg.com/media/D0qH5KvWwAYIYKO.jpg'],
2019-03-02 13:47:02+00:00,pah1974,"ship spotter.posting pics and video's of ships from felixstowe,great yarmouth and sometimes from the Thames.   Also big film fan and most sci-fi stuff.",,Vehicles carrier VIKING AMBER heading for Great Yarmouth's outer harbour 1/3/19 https://t.co/wWNpfbq1Xr,en,,['https://pbs.twimg.com/media/D0qG2H7XgAAKlEB.jpg'],
2019-02-28 08:50:46+00:00,pah1974,"ship spotter.posting pics and video's of ships from felixstowe,great yarmouth and sometimes from the Thames.   Also big film fan and most sci-fi stuff.",,Tanker ANTARES heading for Harwich 27/2/19 https://t.co/BADXHvVPcD,en,,['https://pbs.twimg.com/media/D0ev3PVWkAIK2kt.jpg'],
2019-02-28 08:48:29+00:00,pah1974,"ship spotter.posting pics and video's of ships from felixstowe,great yarmouth and sometimes from the Thames.   Also big film fan and most sci-fi stuff.",,MAASTRICHT MAERSK departing felixstowe after her maiden visit 27/2/19 https://t.co/8Ek6wxoEtu,no,,['https://pbs.twimg.com/media/D0evV2mXcAIGh2G.jpg'],
2019-02-20 18:37:28+00:00,pah1974,"ship spotter.posting pics and video's of ships from felixstowe,great yarmouth and sometimes from the Thames.   Also big film fan and most sci-fi stuff.",,Tanker ANUKET SAPPHIRE heading for ipswich 19/2/19 https://t.co/wkv9cMOHRj,en,,['https://pbs.twimg.com/media/Dz3pOLGXQAA9pzX.jpg'],
2019-02-20 18:35:35+00:00,pah1974,"ship spotter.posting pics and video's of ships from felixstowe,great yarmouth and sometimes from the Thames.   Also big film fan and most sci-fi stuff.",,tanker PHILIPP ESSBERGER heading for harwich 19/2/19 https://t.co/EZrtHjDsYS,de,,['https://pbs.twimg.com/media/Dz3omfAWoAAbkVs.jpg'],
2019-02-20 18:32:39+00:00,pah1974,"ship spotter.posting pics and video's of ships from felixstowe,great yarmouth and sometimes from the Thames.   Also big film fan and most sci-fi stuff.",,MSC VIDHI arriving at felixstowe 19/2/19 https://t.co/WeuwUIOF7K,en,,['https://pbs.twimg.com/media/Dz3oLmUWsAAciY9.jpg'],
2019-02-07 08:27:12+00:00,pah1974,"ship spotter.posting pics and video's of ships from felixstowe,great yarmouth and sometimes from the Thames.   Also big film fan and most sci-fi stuff.",,IJSSELDIJK berthed at the port of ipswich 6/2/19 https://t.co/BOxn3fIPiT,nl,,['https://pbs.twimg.com/media/DyygjybWkAEQTg0.jpg'],
2019-02-07 08:23:26+00:00,pah1974,"ship spotter.posting pics and video's of ships from felixstowe,great yarmouth and sometimes from the Thames.   Also big film fan and most sci-fi stuff.",,Tanker AMARANTH (Ex DEFNE-S) departing ipswich 6/2/19 https://t.co/sVIcx9zST2,en,,['https://pbs.twimg.com/media/DyygAu0XcAAdHE8.jpg'],
2019-02-07 08:21:17+00:00,pah1974,"ship spotter.posting pics and video's of ships from felixstowe,great yarmouth and sometimes from the Thames.   Also big film fan and most sci-fi stuff.",,CHRISTINE heading up the river orwell into ipswich 6/2/19 https://t.co/iUUsNNJEwN,en,,['https://pbs.twimg.com/media/DyyfVLEX0AAtthh.jpg'],
2019-02-03 15:31:49+00:00,pah1974,"ship spotter.posting pics and video's of ships from felixstowe,great yarmouth and sometimes from the Thames.   Also big film fan and most sci-fi stuff.",,EKMEN TRANS heading into the port of ipswich 2/2/19 https://t.co/kl3UMydPSK,en,,['https://pbs.twimg.com/media/DyfbtmLWsAEyFXd.jpg'],
2019-02-03 15:28:27+00:00,pah1974,"ship spotter.posting pics and video's of ships from felixstowe,great yarmouth and sometimes from the Thames.   Also big film fan and most sci-fi stuff.",,BURHAN DIZMAN 3 berthed at ipswich 2/2/19 https://t.co/Bik4L84bVU,cy,,['https://pbs.twimg.com/media/Dyfa3-kW0AA6qml.jpg'],
2019-01-27 21:41:21+00:00,pah1974,"ship spotter.posting pics and video's of ships from felixstowe,great yarmouth and sometimes from the Thames.   Also big film fan and most sci-fi stuff.",,EVER GIFTED making her maiden arrival at the port of felixstowe 20/1/19 https://t.co/kK9eRRA0ft,en,,['https://pbs.twimg.com/media/Dx8sz8AX0AA1C-2.jpg'],
2019-01-27 21:35:18+00:00,pah1974,"ship spotter.posting pics and video's of ships from felixstowe,great yarmouth and sometimes from the Thames.   Also big film fan and most sci-fi stuff.",,HNLMS GRONINGEN berthed at the port of ipswich for a 4day goodwill visit 25/1/19. https://t.co/vxvYNBKTyA,en,,['https://pbs.twimg.com/media/Dx8rOolXcAAWYgo.jpg'],
2019-01-26 15:30:19+00:00,pah1974,"ship spotter.posting pics and video's of ships from felixstowe,great yarmouth and sometimes from the Thames.   Also big film fan and most sci-fi stuff.",,HNLMS GRONINGEN arriving at the port of ipswich on a goodwill visit 25/1/19 https://t.co/7wW0Y8wJkK,en,,['https://pbs.twimg.com/media/Dx2OOREWsAMu5WX.jpg'],
2018-12-24 16:54:39+00:00,pah1974,"ship spotter.posting pics and video's of ships from felixstowe,great yarmouth and sometimes from the Thames.   Also big film fan and most sci-fi stuff.",,136m length QAMUTIK heading in to the port of Ipswich this afternoon. https://t.co/GDAtpKkOtp,en,,['https://pbs.twimg.com/media/DvMlsDKX0AAXk7k.jpg'],
2018-12-20 18:28:49+00:00,pah1974,"ship spotter.posting pics and video's of ships from felixstowe,great yarmouth and sometimes from the Thames.   Also big film fan and most sci-fi stuff.",,ex HMS VALE P155 now a cafe on the banks of the river deben at melton 20/12/18 https://t.co/6dfAYSIFRj,en,,['https://pbs.twimg.com/media/Du4UeonWsAA6XQk.jpg'],
2018-11-21 18:56:36+00:00,pah1974,"ship spotter.posting pics and video's of ships from felixstowe,great yarmouth and sometimes from the Thames.   Also big film fan and most sci-fi stuff.",,KARL-JAKOB K. berthed at ipswich 21/11/18 https://t.co/xfbHjHNACc,et,,['https://pbs.twimg.com/media/DsjFImiXoAAoYgw.jpg'],
2018-11-21 18:55:14+00:00,pah1974,"ship spotter.posting pics and video's of ships from felixstowe,great yarmouth and sometimes from the Thames.   Also big film fan and most sci-fi stuff.",,MAPLE LIV heading into ipswich this morning. https://t.co/pihc6x2e11,en,,['https://pbs.twimg.com/media/DsjE0buXgAABqjR.jpg'],
2018-11-14 12:35:51+00:00,pah1974,"ship spotter.posting pics and video's of ships from felixstowe,great yarmouth and sometimes from the Thames.   Also big film fan and most sci-fi stuff.",,MAERSK HORSBURGH departing Felixstowe 13/11/18. https://t.co/56L6dODa3K,und,,['https://pbs.twimg.com/media/Dr9q24tW4AI1qdF.jpg'],
2018-11-14 12:34:11+00:00,pah1974,"ship spotter.posting pics and video's of ships from felixstowe,great yarmouth and sometimes from the Thames.   Also big film fan and most sci-fi stuff.",,@ArklowShipping ARKLOW BEACH passing Felixstowe inbound for @abports21 ipswich 13/11/18 https://t.co/JVs0i2FdIg,en,,['https://pbs.twimg.com/media/Dr9qejwWkAIbs-Z.jpg'],
2018-11-14 12:31:31+00:00,pah1974,"ship spotter.posting pics and video's of ships from felixstowe,great yarmouth and sometimes from the Thames.   Also big film fan and most sci-fi stuff.",,EVER GIVEN at felixstowe 13/11/18 https://t.co/bmc9HP5vDA,en,,['https://pbs.twimg.com/media/Dr9p3IZXQAA_2Ei.jpg'],
2018-11-14 12:29:52+00:00,pah1974,"ship spotter.posting pics and video's of ships from felixstowe,great yarmouth and sometimes from the Thames.   Also big film fan and most sci-fi stuff.",,Tanker ALAND passing Felixstowe inbound for Harwich 13/11/18 https://t.co/1CtIMsS9Fw,en,,['https://pbs.twimg.com/media/Dr9pfilX0AUBJqb.jpg'],
2018-11-13 19:25:35+00:00,pah1974,"ship spotter.posting pics and video's of ships from felixstowe,great yarmouth and sometimes from the Thames.   Also big film fan and most sci-fi stuff.",,RT @rascalmaster: #ProactivePilotTraining on a nice autumnal morning... @ABP_SSP @rascalmaster @harwichhaven https://t.co/3MINCWN2VG,en,['ProactivePilotTraining'],['https://pbs.twimg.com/ext_tw_video_thumb/1062418344668774400/pu/img/AW2dWGs6s79DGPYu.jpg'],
2018-11-12 16:46:41+00:00,pah1974,"ship spotter.posting pics and video's of ships from felixstowe,great yarmouth and sometimes from the Thames.   Also big film fan and most sci-fi stuff.",,RT @GeoffreyWatson2: First visit to the Thames for Polar Mexico https://t.co/8rrXrXEF48,en,,['https://pbs.twimg.com/media/Dr0ARFbWkAA7lpS.jpg'],
2018-11-04 10:14:06+00:00,pah1974,"ship spotter.posting pics and video's of ships from felixstowe,great yarmouth and sometimes from the Thames.   Also big film fan and most sci-fi stuff.",,FPV MORVEN approaching Shotley 31/10/18 https://t.co/74vTQepKaY,en,,['https://pbs.twimg.com/media/DrJqhCHW4AAWwFy.jpg'],
2018-11-04 10:08:39+00:00,pah1974,"ship spotter.posting pics and video's of ships from felixstowe,great yarmouth and sometimes from the Thames.   Also big film fan and most sci-fi stuff.",,WESSEX EXPLORER - Shotley marina 31/10/18 https://t.co/iuEF2opm2l,en,,['https://pbs.twimg.com/media/DrJpQ7-X4AEQWOl.jpg'],
2018-11-04 10:06:45+00:00,pah1974,"ship spotter.posting pics and video's of ships from felixstowe,great yarmouth and sometimes from the Thames.   Also big film fan and most sci-fi stuff.",,DONAU and thames guardian - ipswich 31/10/18 https://t.co/7j8RGyppCx,en,,['https://pbs.twimg.com/media/DrJo1TFWkAAPf_T.jpg'],
2018-11-04 10:03:38+00:00,pah1974,"ship spotter.posting pics and video's of ships from felixstowe,great yarmouth and sometimes from the Thames.   Also big film fan and most sci-fi stuff.",,Bulk carrier IDA departing ipswich 31/10/18 https://t.co/7YPzbq9cQR,en,,['https://pbs.twimg.com/media/DrJoHggXcAAPTIf.jpg'],
2018-10-28 12:34:23+00:00,pah1974,"ship spotter.posting pics and video's of ships from felixstowe,great yarmouth and sometimes from the Thames.   Also big film fan and most sci-fi stuff.",,thames patrol/pilot boat on duty passing gravesend 23/10/18 https://t.co/frwK5CecHM,en,,['https://pbs.twimg.com/media/DqmHRcLX0AEZu02.jpg'],
2018-10-27 20:23:17+00:00,pah1974,"ship spotter.posting pics and video's of ships from felixstowe,great yarmouth and sometimes from the Thames.   Also big film fan and most sci-fi stuff.",,Dredger DC VLAANDEREN 3000 (not seen this one before) passing tilbury/gravesend 23/10/18 https://t.co/DSMOkgiHw4,en,,['https://pbs.twimg.com/media/DqioOKfWoAATfMd.jpg'],
2018-10-27 15:18:05+00:00,pah1974,"ship spotter.posting pics and video's of ships from felixstowe,great yarmouth and sometimes from the Thames.   Also big film fan and most sci-fi stuff.",,GPS INDIA and SILVER BEAM passing gravesend 23/10/18 https://t.co/WL1KMbTwG9,en,,['https://pbs.twimg.com/media/DqhjMwfX0AEzHgz.jpg'],
2018-10-27 08:28:24+00:00,pah1974,"ship spotter.posting pics and video's of ships from felixstowe,great yarmouth and sometimes from the Thames.   Also big film fan and most sci-fi stuff.",,ARKLOW FERN passing Tilbury/gravesend 23/10/18 https://t.co/fcBau2LE32,en,,['https://pbs.twimg.com/media/DqgFmfYWkAAyuII.jpg'],
2018-10-27 08:24:45+00:00,pah1974,"ship spotter.posting pics and video's of ships from felixstowe,great yarmouth and sometimes from the Thames.   Also big film fan and most sci-fi stuff.",,CELESTINE passing gravesend 23/10/18 https://t.co/wXsuxuKE1d,en,,['https://pbs.twimg.com/media/DqgExK4WwAEMOzb.jpg'],
2018-10-26 08:07:04+00:00,pah1974,"ship spotter.posting pics and video's of ships from felixstowe,great yarmouth and sometimes from the Thames.   Also big film fan and most sci-fi stuff.",,ALINDA heading past tilbury fort 23/10/18 https://t.co/KhoQDyz9zp,en,,['https://pbs.twimg.com/media/Dqa27HLX4AA-C1L.jpg'],
2018-10-26 08:04:02+00:00,pah1974,"ship spotter.posting pics and video's of ships from felixstowe,great yarmouth and sometimes from the Thames.   Also big film fan and most sci-fi stuff.",,@SvitzerGlobal svitzer london heading past gravesend 23/10/18 https://t.co/ggBc8kwI6h,en,,['https://pbs.twimg.com/media/Dqa2LQWXQAIhuRw.jpg'],
2018-10-26 08:01:27+00:00,pah1974,"ship spotter.posting pics and video's of ships from felixstowe,great yarmouth and sometimes from the Thames.   Also big film fan and most sci-fi stuff.",,Dredgers SCELVERINGHE and REIMERSWAAL heading past tilbury/gravesend 23/10/18 https://t.co/gJb3RPDM14,en,,['https://pbs.twimg.com/media/Dqa03LdWwAAZXTW.jpg'],
2018-10-25 14:33:59+00:00,pah1974,"ship spotter.posting pics and video's of ships from felixstowe,great yarmouth and sometimes from the Thames.   Also big film fan and most sci-fi stuff.",,ARKLOW ROVER passing tilbury/gravesend 23/10/18 https://t.co/yBzt6Q37DI,en,,['https://pbs.twimg.com/media/DqXF721WsAAOxPB.jpg'],
2018-10-25 14:29:24+00:00,pah1974,"ship spotter.posting pics and video's of ships from felixstowe,great yarmouth and sometimes from the Thames.   Also big film fan and most sci-fi stuff.",,SVITZER ADIRA passing gravesend 23/10/18 https://t.co/DRs3PNuSpd,da,,['https://pbs.twimg.com/media/DqXE1QNX0AAEdUT.jpg'],
2018-10-25 09:31:48+00:00,pah1974,"ship spotter.posting pics and video's of ships from felixstowe,great yarmouth and sometimes from the Thames.   Also big film fan and most sci-fi stuff.",,Bulk carrier STAR HARMONY outbound from tilbury docks 23/10/18 https://t.co/IdQQORjcg0,en,,['https://pbs.twimg.com/media/DqWAwYKWsAEdYeB.jpg'],
2018-10-25 09:28:54+00:00,pah1974,"ship spotter.posting pics and video's of ships from felixstowe,great yarmouth and sometimes from the Thames.   Also big film fan and most sci-fi stuff.",,ro-ro VALENTINE passing gravesend 23/10/18 https://t.co/6B21RMZ8qN,it,,['https://pbs.twimg.com/media/DqWABnSX4AAdsi7.jpg'],
2018-10-25 09:26:15+00:00,pah1974,"ship spotter.posting pics and video's of ships from felixstowe,great yarmouth and sometimes from the Thames.   Also big film fan and most sci-fi stuff.",,POLAR ARGENTINA and superyacht KISMET passing gravesend 23/10/18 https://t.co/x2IGlrcNKd,en,,['https://pbs.twimg.com/media/DqV_bN4WkAAKbia.jpg'],
2018-10-25 09:22:49+00:00,pah1974,"ship spotter.posting pics and video's of ships from felixstowe,great yarmouth and sometimes from the Thames.   Also big film fan and most sci-fi stuff.",,MARCO POLO arriving at tilbury 23/10/18 https://t.co/gW9eT2BAgJ,en,,['https://pbs.twimg.com/media/DqV-v0YWoAE81be.jpg'],
2018-10-14 16:38:39+00:00,pah1974,"ship spotter.posting pics and video's of ships from felixstowe,great yarmouth and sometimes from the Thames.   Also big film fan and most sci-fi stuff.",,Thames sailing barge THISTLE outbound from ipswich 13/10/18 https://t.co/hRwfyOImeB,en,,['https://pbs.twimg.com/media/Dpe49_NWsAAFo9j.jpg'],
2018-10-14 10:27:02+00:00,pah1974,"ship spotter.posting pics and video's of ships from felixstowe,great yarmouth and sometimes from the Thames.   Also big film fan and most sci-fi stuff.",,WILSON LIMERICK berthed at ipswich and BEAUTRITON heading up the river orwell to ipswich 13/10/18. https://t.co/zz1WXWELI8,en,,['https://pbs.twimg.com/media/DpdjxpWXgAAosyg.jpg'],
2018-10-12 09:08:49+00:00,pah1974,"ship spotter.posting pics and video's of ships from felixstowe,great yarmouth and sometimes from the Thames.   Also big film fan and most sci-fi stuff.",,Dutch schooner SWAENSBORGH heading up the river orwell to ipswich 11/10/18 https://t.co/DPNVeqBdjY,en,,['https://pbs.twimg.com/media/DpS-aBQV4AAfhjW.jpg'],
2018-10-12 08:45:26+00:00,pah1974,"ship spotter.posting pics and video's of ships from felixstowe,great yarmouth and sometimes from the Thames.   Also big film fan and most sci-fi stuff.",,Dutch sailing vessels LUCIANA and ZUIDERZEE heading up the river orwell for ipswich 11/10/18 https://t.co/IR0uBIpe0d,en,,['https://pbs.twimg.com/media/DpS4_MVV4AA_Xt-.jpg'],
2018-10-11 15:09:27+00:00,pah1974,"ship spotter.posting pics and video's of ships from felixstowe,great yarmouth and sometimes from the Thames.   Also big film fan and most sci-fi stuff.",,IDE MIN and ABEL TASMAN sailing up the river orwell to ipswich 11/10/18 https://t.co/LPUrxaEYaB,en,,['https://pbs.twimg.com/media/DpPHuL9WwAAyy0N.jpg'],
2018-10-11 15:07:16+00:00,pah1974,"ship spotter.posting pics and video's of ships from felixstowe,great yarmouth and sometimes from the Thames.   Also big film fan and most sci-fi stuff.",,ARTEMIS sailing up the river orwell to ipswich 11/10/18 https://t.co/NMTKK3G4Sf,en,,['https://pbs.twimg.com/media/DpPHOY8X4AA2QR1.jpg'],
2018-10-10 07:58:46+00:00,pah1974,"ship spotter.posting pics and video's of ships from felixstowe,great yarmouth and sometimes from the Thames.   Also big film fan and most sci-fi stuff.",,"IBERICA HAV,AASFJORD and ARKLOW FALCON passing felixstowe outbound from ipswich 9/10/18. https://t.co/NKbIEqYMEC",en,,['https://pbs.twimg.com/media/DpIbJgRX4AASrUZ.jpg'],
2018-10-03 21:02:53+00:00,pah1974,"ship spotter.posting pics and video's of ships from felixstowe,great yarmouth and sometimes from the Thames.   Also big film fan and most sci-fi stuff.",,"RT @Milestoner1: Inbound selection passing Tilbury. 3-10-2018.
EMS HIGHWAY
CELESTINE
ANMIRO
ARCO AXE
CSCC EUROPE https://t.co/2ANShjLs0C",en,,['https://pbs.twimg.com/ext_tw_video_thumb/1047578459655036928/pu/img/4z9uymprE8h9nlTp.jpg'],
2018-09-16 12:31:39+00:00,pah1974,"ship spotter.posting pics and video's of ships from felixstowe,great yarmouth and sometimes from the Thames.   Also big film fan and most sci-fi stuff.",,FORTH CONSTRUCTOR outbound from harwich and MAIKE D departing felixstowe 14/9/18 https://t.co/4UCI0pkhBA,en,,['https://pbs.twimg.com/media/DnNzwOfXoAAxnK6.jpg'],
2018-09-16 10:20:40+00:00,pah1974,"ship spotter.posting pics and video's of ships from felixstowe,great yarmouth and sometimes from the Thames.   Also big film fan and most sci-fi stuff.",,sloman dispatcher and normand flower heading for harwich 14/9/18 https://t.co/AxPFVjfNcR,en,,['https://pbs.twimg.com/media/DnNV1XtWwAEdyFD.jpg'],
2018-09-06 08:51:50+00:00,pah1974,"ship spotter.posting pics and video's of ships from felixstowe,great yarmouth and sometimes from the Thames.   Also big film fan and most sci-fi stuff.",,"FUGRO SEEKER at fox's marina,ipswich 3/9/18 https://t.co/sYjRvRpz65",en,,['https://pbs.twimg.com/media/DmZhcGQWwAIdqEA.jpg'],
2018-09-05 15:48:23+00:00,pah1974,"ship spotter.posting pics and video's of ships from felixstowe,great yarmouth and sometimes from the Thames.   Also big film fan and most sci-fi stuff.",,dredger barent zanen at felixstowe 3/9/18 https://t.co/b8SabBEMX8,en,,['https://pbs.twimg.com/media/DmV3OokXcAAO7RN.jpg'],
2018-09-05 14:45:34+00:00,pah1974,"ship spotter.posting pics and video's of ships from felixstowe,great yarmouth and sometimes from the Thames.   Also big film fan and most sci-fi stuff.",,@briggsmarine @harwichhaven forth drummer at felixstowe 3/9/18 https://t.co/TvjMo40H3z,en,,['https://pbs.twimg.com/media/DmVnrESX0AE0Mwv.jpg'],
2018-09-05 12:12:39+00:00,pah1974,"ship spotter.posting pics and video's of ships from felixstowe,great yarmouth and sometimes from the Thames.   Also big film fan and most sci-fi stuff.",,MSC PERLE and EDITH MAERSK departing felixstowe 3/9/18 https://t.co/8NThOAdZQC,en,,['https://pbs.twimg.com/media/DmVFtVUXoAEatRV.jpg'],
2018-08-27 13:04:44+00:00,pah1974,"ship spotter.posting pics and video's of ships from felixstowe,great yarmouth and sometimes from the Thames.   Also big film fan and most sci-fi stuff.",,"Dredger BARENT ZANEN,GPS BATTLER and bulk carrier STAR II - felixstowe 25/8/18 https://t.co/pFYh2n8yH3",en,,['https://pbs.twimg.com/media/Dlm7JhAXgAIExvO.jpg'],
2018-08-27 13:00:21+00:00,pah1974,"ship spotter.posting pics and video's of ships from felixstowe,great yarmouth and sometimes from the Thames.   Also big film fan and most sci-fi stuff.",,jackup platform PARAGON C20051 with tugs ZEUS OF FINLAND and THOR passing felixstowe inbound for harwich 25/8/18 https://t.co/of7J5IKOwb,en,,['https://pbs.twimg.com/media/Dlm6ObQXoAINoX_.jpg'],
2018-08-19 16:23:56+00:00,pah1974,"ship spotter.posting pics and video's of ships from felixstowe,great yarmouth and sometimes from the Thames.   Also big film fan and most sci-fi stuff.",,Historic tug KENT and thames sailing barge KITTY heading for ipswich 17/8/18 https://t.co/euwlnbHEox,en,,['https://pbs.twimg.com/media/Dk-cIkrXoAAsq0R.jpg'],
2018-07-14 15:15:49+00:00,pah1974,"ship spotter.posting pics and video's of ships from felixstowe,great yarmouth and sometimes from the Thames.   Also big film fan and most sci-fi stuff.",,MORTEN MAERSK/MURCIA MAERSK &amp; EDDA FONN - felixstowe 14/7/18 https://t.co/DnDYYYq6kl,cy,,['https://pbs.twimg.com/media/DiEz3rlW4AUIBGO.jpg'],
2018-07-11 11:15:10+00:00,pah1974,"ship spotter.posting pics and video's of ships from felixstowe,great yarmouth and sometimes from the Thames.   Also big film fan and most sci-fi stuff.",,Thames barge HYDROGEN heading outbound from the river Orwell 2/7/18 https://t.co/xnyl8qyhrf,en,,['https://pbs.twimg.com/media/Dh0gDXSW4AYpEQb.jpg'],
2018-07-11 10:58:57+00:00,pah1974,"ship spotter.posting pics and video's of ships from felixstowe,great yarmouth and sometimes from the Thames.   Also big film fan and most sci-fi stuff.",,SVITZER INTREPID back at felixstowe 2/7/18 https://t.co/go59Q8o20E,en,,['https://pbs.twimg.com/media/Dh0cU3UWsAA7zZJ.jpg'],
2018-06-18 14:21:32+00:00,pah1974,"ship spotter.posting pics and video's of ships from felixstowe,great yarmouth and sometimes from the Thames.   Also big film fan and most sci-fi stuff.",,Fisheries/research vessel CEFAS ENDEAVOUR arriving back at Lowestoft 17/6/18 https://t.co/CP5g9TI2Zp,en,,['https://pbs.twimg.com/media/Df-uI6pXkAEbnfx.jpg'],
2018-06-18 14:17:44+00:00,pah1974,"ship spotter.posting pics and video's of ships from felixstowe,great yarmouth and sometimes from the Thames.   Also big film fan and most sci-fi stuff.",,TOPLIFT berthed at Lowestoft 17/6/18 https://t.co/VokpQCMSjD,da,,['https://pbs.twimg.com/media/Df-tRFeX4AAVIRU.jpg'],
2018-05-24 06:55:50+00:00,pah1974,"ship spotter.posting pics and video's of ships from felixstowe,great yarmouth and sometimes from the Thames.   Also big film fan and most sci-fi stuff.",,@OrwellLady just off berth9 at felixstowe on 20/5/18 https://t.co/QNXumeUd86,en,,['https://pbs.twimg.com/media/Dd8YYqAU0AERrXN.jpg'],
2018-05-17 09:26:15+00:00,pah1974,"ship spotter.posting pics and video's of ships from felixstowe,great yarmouth and sometimes from the Thames.   Also big film fan and most sci-fi stuff.",,MAERSK EINDHOVEN departing felixstowe 14/5/18 https://t.co/ke1zaruqZ7,no,,['https://pbs.twimg.com/media/DdY3rtWX0AAbdBb.jpg'],
2018-05-17 09:24:19+00:00,pah1974,"ship spotter.posting pics and video's of ships from felixstowe,great yarmouth and sometimes from the Thames.   Also big film fan and most sci-fi stuff.",,COSTA FAVOLOSA inbound for Harwich 14/5/18 https://t.co/KAKhtdiZjK,en,,['https://pbs.twimg.com/media/DdY3P9LWsAAIhsw.jpg'],
2018-05-17 09:20:29+00:00,pah1974,"ship spotter.posting pics and video's of ships from felixstowe,great yarmouth and sometimes from the Thames.   Also big film fan and most sci-fi stuff.",,"Arklow clan &amp; suntis heading for ipswich,rms twisteden for mistley and nordic sund outbound from Harwich 14/5/18 https://t.co/YnUqhRLxju",en,,['https://pbs.twimg.com/media/DdY2T15W4AAoCaB.jpg'],
2018-05-01 12:04:55+00:00,pah1974,"ship spotter.posting pics and video's of ships from felixstowe,great yarmouth and sometimes from the Thames.   Also big film fan and most sci-fi stuff.",,OOCL HONG KONG arriving at felixstowe 26/4/18 https://t.co/FtqHzoGp1Y,en,,['https://pbs.twimg.com/media/DcHCk1mW0AA9Gz_.jpg'],
2018-05-01 11:21:17+00:00,pah1974,"ship spotter.posting pics and video's of ships from felixstowe,great yarmouth and sometimes from the Thames.   Also big film fan and most sci-fi stuff.",,OOCL UNITED KINGDOM departing felixstowe 26/4/18 https://t.co/9jGEqjNEuf,en,,['https://pbs.twimg.com/media/DcG4lZEW4AAGjz3.jpg'],
2018-04-06 08:19:40+00:00,pah1974,"ship spotter.posting pics and video's of ships from felixstowe,great yarmouth and sometimes from the Thames.   Also big film fan and most sci-fi stuff.",,@Milestoner1 @GeoffreyWatson2 ZHEN HUA 23 departs felixstowe yesterday after unloading 2new huge cranes. https://t.co/sF5SDBiQJa,en,,['https://pbs.twimg.com/media/DaFfQ0uVMAAwF4X.jpg'],
2018-03-22 11:59:41+00:00,pah1974,"ship spotter.posting pics and video's of ships from felixstowe,great yarmouth and sometimes from the Thames.   Also big film fan and most sci-fi stuff.",,RT @jason_photos: @MedwayMessenger it's coming down https://t.co/JazWmvFObF,en,,['https://pbs.twimg.com/ext_tw_video_thumb/976765072122007552/pu/img/CzYpfX_weffJL1JK.jpg'],
2018-03-11 13:19:26+00:00,pah1974,"ship spotter.posting pics and video's of ships from felixstowe,great yarmouth and sometimes from the Thames.   Also big film fan and most sci-fi stuff.",,@2000MX5 @Milestoner1 AFON CEFNI working at felixstowe 9/3/18 https://t.co/MHS48CUhm8,cy,,['https://pbs.twimg.com/media/DYAqi6AXUAAI7ow.jpg'],
2018-02-28 12:28:54+00:00,pah1974,"ship spotter.posting pics and video's of ships from felixstowe,great yarmouth and sometimes from the Thames.   Also big film fan and most sci-fi stuff.",,RT @Maz_Brook: @BBCLookEast Busy snow day for a Star Wars fan in Wivenhoe! https://t.co/MXUZe21Esy,en,,['https://pbs.twimg.com/media/DXHyse0XkAAViX8.jpg'],
2018-02-27 11:21:38+00:00,pah1974,"ship spotter.posting pics and video's of ships from felixstowe,great yarmouth and sometimes from the Thames.   Also big film fan and most sci-fi stuff.",,@Milestoner1 @YouTube it usually misses us when it snows but not this time. https://t.co/SwVHaijdB4,en,,['https://pbs.twimg.com/media/DXCcezkW4AInJuY.jpg'],
2018-02-18 09:38:38+00:00,pah1974,"ship spotter.posting pics and video's of ships from felixstowe,great yarmouth and sometimes from the Thames.   Also big film fan and most sci-fi stuff.",,@Milestoner1 @GeoffreyWatson2 Dredger FREEWAY departing felixstowe 15/2/18 https://t.co/86SzOeAkF1,en,,['https://pbs.twimg.com/media/DWTuoGIXcAE4IYM.jpg'],
2018-02-18 09:36:34+00:00,pah1974,"ship spotter.posting pics and video's of ships from felixstowe,great yarmouth and sometimes from the Thames.   Also big film fan and most sci-fi stuff.",,@Milestoner1 MAGEBY MAERSK berthing at felixstowe 15/2/18 https://t.co/NbUxood0cH,en,,['https://pbs.twimg.com/media/DWTuJUpWAAEu3iE.jpg'],
2018-02-18 09:34:52+00:00,pah1974,"ship spotter.posting pics and video's of ships from felixstowe,great yarmouth and sometimes from the Thames.   Also big film fan and most sci-fi stuff.",,@Milestoner1 @GeoffreyWatson2 MSC MIRJAM departs felixstowe 15/2/18 https://t.co/BsinivUaew,ht,,['https://pbs.twimg.com/media/DWTtwSAXcAMkPnl.jpg'],
2018-02-18 09:33:40+00:00,pah1974,"ship spotter.posting pics and video's of ships from felixstowe,great yarmouth and sometimes from the Thames.   Also big film fan and most sci-fi stuff.",,@Milestoner1 AASHEIM passing felixstowe for ipswich 15/2/18 https://t.co/0ShDZX3pQD,en,,['https://pbs.twimg.com/media/DWTtfCOX4AAHe9y.jpg'],
2018-02-09 18:41:25+00:00,pah1974,"ship spotter.posting pics and video's of ships from felixstowe,great yarmouth and sometimes from the Thames.   Also big film fan and most sci-fi stuff.",,@Milestoner1 @GeoffreyWatson2 MORAG M working at felixstowe 8/2/18 https://t.co/azw1DdMzUD,en,,['https://pbs.twimg.com/media/DVnUfCrVAAAQODk.jpg'],
2018-02-09 18:35:11+00:00,pah1974,"ship spotter.posting pics and video's of ships from felixstowe,great yarmouth and sometimes from the Thames.   Also big film fan and most sci-fi stuff.",,@HolyheadTowing @Milestoner1 @GeoffreyWatson2 Tug AFON LAS at felixstowe 8/2/18 https://t.co/o0eWhtpYuj,en,,['https://pbs.twimg.com/media/DVnTHWLV4AA5PRF.jpg'],
2018-01-29 11:54:51+00:00,pah1974,"ship spotter.posting pics and video's of ships from felixstowe,great yarmouth and sometimes from the Thames.   Also big film fan and most sci-fi stuff.",,@abports21 offshore vessel SEABULK ASIA arriving astern into #lowestoft on her 1st visit 23/1/18 https://t.co/sE9gaLzUL3,en,['lowestoft'],['https://pbs.twimg.com/media/DUtN-85WsAAADWz.jpg'],
2018-01-29 11:44:47+00:00,pah1974,"ship spotter.posting pics and video's of ships from felixstowe,great yarmouth and sometimes from the Thames.   Also big film fan and most sci-fi stuff.",,@GeoffreyWatson2 @Milestoner1 Dredgers REYNAERT and FREEWAY at felixstowe last week. https://t.co/nRJ53wXQKv,en,,['https://pbs.twimg.com/media/DUtLqdAW4AEsa69.jpg'],
2018-01-29 11:40:00+00:00,pah1974,"ship spotter.posting pics and video's of ships from felixstowe,great yarmouth and sometimes from the Thames.   Also big film fan and most sci-fi stuff.",,@wavecrestglen @Milestoner1 @GeoffreyWatson2 @2000MX5 Tug AFON LAS and JOSINE working at felixstowe last week. https://t.co/yDZsUxY7Jq,en,,['https://pbs.twimg.com/media/DUtKkivW0AAtkib.jpg'],
2017-12-12 11:24:16+00:00,pah1974,"ship spotter.posting pics and video's of ships from felixstowe,great yarmouth and sometimes from the Thames.   Also big film fan and most sci-fi stuff.",,@2000MX5 C-FENNA at Lowestoft 3/11/17 https://t.co/l9UYBHiQVm,is,,['https://pbs.twimg.com/media/DQ16sQpW0AE4PfG.jpg'],
2017-12-12 10:22:24+00:00,pah1974,"ship spotter.posting pics and video's of ships from felixstowe,great yarmouth and sometimes from the Thames.   Also big film fan and most sci-fi stuff.",,"@2000MX5 gray salvor,blue horizon and svitzer shotley approaching ipswich 8/12/17. https://t.co/3f2rSjGoyz",en,,['https://pbs.twimg.com/media/DQ1shwnX0AAyzSN.jpg'],
2017-12-12 10:17:21+00:00,pah1974,"ship spotter.posting pics and video's of ships from felixstowe,great yarmouth and sometimes from the Thames.   Also big film fan and most sci-fi stuff.",,@2000MX5 tug GRAY SALVOR assisting blue horizon into @abports21 ipswich on 8/12/17 https://t.co/YeZ9TtHy31,en,,['https://pbs.twimg.com/media/DQ1rXiEWAAIEDXY.jpg'],
2017-12-12 10:12:02+00:00,pah1974,"ship spotter.posting pics and video's of ships from felixstowe,great yarmouth and sometimes from the Thames.   Also big film fan and most sci-fi stuff.",,"@havengore nice to see at fox's marina,ipswich 8/12/17 https://t.co/ysDIXxV5i0",en,,['https://pbs.twimg.com/media/DQ1qGPCXcAAXoOJ.jpg'],
2017-12-11 14:36:35+00:00,pah1974,"ship spotter.posting pics and video's of ships from felixstowe,great yarmouth and sometimes from the Thames.   Also big film fan and most sci-fi stuff.",,@Milestoner1 @deancable oh joy ITS BACK https://t.co/jA8MPE10qS,en,,['https://pbs.twimg.com/media/DQxdHCeVQAA4p5L.jpg'],
2017-12-11 08:55:49+00:00,pah1974,"ship spotter.posting pics and video's of ships from felixstowe,great yarmouth and sometimes from the Thames.   Also big film fan and most sci-fi stuff.",,@Milestoner1 @deancable all gone https://t.co/oPKMVt8Mwl,en,,['https://pbs.twimg.com/media/DQwPHcuUEAAfoxq.jpg'],
